id,text,anger,fear,joy,sadness,surprise
eng_train_track_a_00856,"Of course, in the end I had a better essay to hand in ( can't remember how this impacted the grade ) but I didn't feel like the work I was turning in was mine.So when I'm editing Jenn's work a shiver runs down my spine that my father is also standing above my shoulder editing my edits.",0,1,0,0,0
eng_train_track_a_00860,"When it was my turn to play, I was mortified to find out I had to move my hand up and down in a sawing motion.",0,1,0,0,0
eng_train_track_a_00862,( Notice my toes have nail polish on-that was New Year's resolution # 21 $ ) Then Esm decorated the body tracing.,0,0,1,0,0
eng_train_track_a_00866,I remember bringing it to my kindergarten class once to watch on a movie day.,0,0,1,0,0
eng_train_track_a_00868,"However, deep inside my heart, I really want to go back to my hometown.",0,0,0,1,0
eng_train_track_a_00869,I still can't figure it out.,0,1,0,1,1
eng_train_track_a_00870,"this probably doesn't actually make much sense at the moment, but my head hurts.",0,1,0,0,0
eng_train_track_a_00875,"And here in Edinburgh, through this journey of mine, it has been right at my side, in my hand.",0,0,1,0,0
eng_train_track_a_00877,Probably going to get buried.,0,1,0,1,0
eng_train_track_a_00878,A nice way to get some items off my chest.,0,0,1,0,0
eng_train_track_a_00880,"I spent all day at home, sick.",0,1,0,1,0
eng_train_track_a_00881,still cant get my head around the fact that this time 2 weeks ill be home.,0,1,0,0,0
eng_train_track_a_00884,I had to relax my muscles and clear my mind in order to do that.,0,1,0,0,0
eng_train_track_a_00886,"`` I zip up the tote back quickly, throw it onto my shoulder and grab up the other, larger bag.",0,0,1,0,0
eng_train_track_a_00888,He had a large going away party.,0,0,1,0,0
eng_train_track_a_00889,"`` Yeah, im good now, my back has stopped bleeding $.",0,1,0,0,0
eng_train_track_a_00893,Thoughts of the movie Phantasm were swirling through my head.,0,1,0,0,0
eng_train_track_a_00894,After reading the top comment about the person's mom and her friend... maybe she isn't telling me something.,0,1,0,0,1
eng_train_track_a_00895,"Standing at the edge of my heart, I'm gazing, I'm listening Like seeing an ocean in a cold winter night Such a fear, I'm falling, breaking into pieces.",0,1,0,1,0
eng_train_track_a_00896,I liked spending all my nights at home hula hooping and listening to pop music and laughing at jokes inside my head.,0,0,1,0,0
eng_train_track_a_00897,"I stumbled out of bed, probably 4 in a morning in a most-asleep daze and went to the bathroom.",0,1,0,0,0
eng_train_track_a_00898,"Shivering caused me to tense up, which caused my hips to keep cramping in charlie horse fashion.",0,1,0,1,0
eng_train_track_a_00900,"It was a sad, strange experience.",0,1,0,1,1
eng_train_track_a_00902,Like I found a way to escape gravity and moved about my bedroom as though I was on the ISS or something; thrilling at my new found ability.,0,0,1,0,1
eng_train_track_a_00903,40 minutes of genuinely thinking it's quite possible I may never leave those woods.,0,1,0,1,0
eng_train_track_a_00904,My blood turned to icewater in my veins.,0,1,0,0,0
eng_train_track_a_00905,My arms start getting numb and achy and no way to lie makes them stop.,0,1,0,1,0
eng_train_track_a_00908,And they probably knew exactly what your dad saw.,0,1,0,0,1
eng_train_track_a_00910,"My eyes were open, but I couldn't see in any colors.",0,1,0,1,0
eng_train_track_a_00911,"But I get beyond that tired stage, and can't close my eyes later.",0,1,0,1,0
eng_train_track_a_00915,So anyways it's late at night and I was down in my living room sleeping on my couch.,0,0,0,0,0
eng_train_track_a_00917,", my stomach turned into a pile of dogshit and I nearly puked.",0,1,0,0,0
eng_train_track_a_00918,At times I was actually having difficulty breathing because the water was in my nose.,0,1,0,0,0
eng_train_track_a_00919,"It worked, I was scared shitless for the rest of the visit.",0,1,0,0,0
eng_train_track_a_00920,So my leg is shaking at a million miles an hour and I turn into the target parking lot as she sort of continues to follow me.,0,1,0,0,0
eng_train_track_a_00922,"blah I want my head to stop hurting, and my eyes to start tearing up but I do nt see any of these things happening soon.",0,1,0,1,0
eng_train_track_a_00924,My hands were very cold.,0,1,0,0,0
eng_train_track_a_00925,and then i accidently dropped the tag because my hand was shaking so much.,0,1,0,0,0
eng_train_track_a_00930,"So I went ahead and finished it, but it fits my head without quite covering my ears, so even though I started out knitting it for you, it didn't end up working.",0,0,0,0,0
eng_train_track_a_00932,"So they decided to throw me a ""90s McDonalds"" Birthday party.",0,0,1,0,1
eng_train_track_a_00933,"It never freaked me out, because it happened enough as i was small and I got used to it.",0,1,0,0,0
eng_train_track_a_00938,"I know this will get buried, but whatever.",0,0,0,1,0
eng_train_track_a_00939,He also told me I would be his wife one day.,0,0,1,0,1
eng_train_track_a_00940,We shared about a minute of spaz-dancing and off-key singing before we went our seperate ways.,0,0,1,0,0
eng_train_track_a_00942,They buy energy from 'energy generators' and sell it to you the customer.,0,0,0,0,0
eng_train_track_a_00943,I struggle to make out the images my eyes begin to pick up.,0,1,0,0,0
eng_train_track_a_00944,"I jumped out wrapped a towel around me, dried off my hand and face and answered it.",0,0,0,0,0
eng_train_track_a_00949,I felt like Batman that day.,0,0,1,0,0
eng_train_track_a_00950,i closed my eyes and heard something hit the ground.,0,1,0,0,1
eng_train_track_a_00952,W-WORST HABIT: Not washing my face before I go to bed.,0,0,0,0,0
eng_train_track_a_00954,"I was sitting in the van trying to stay warm, and going over the following day's logistics in my head.",0,1,0,0,0
eng_train_track_a_00957,My Heart was just... beautiful.,0,0,1,0,0
eng_train_track_a_00958,Decide to be roommates.,0,0,1,0,0
eng_train_track_a_00959,and my hair was straight and nice already so i pull a sweater over my head and jump into some jeans run to the bathroom brush my teeth while combing my hair with my fingers grab my purse and im out the door with sunglasses on cuz i got no makeup on... so i get to the bus stop and realize... I forgot to put out the bottles and a check for the waterman who comes at 9 AM!,0,1,0,0,0
eng_train_track_a_00960,Then a few days later i told her Jenny wanted me to come to the basement to play with her.,0,1,0,0,1
eng_train_track_a_00961,Or like when the one of the 4-year-olds I substitute taught at church asked why I was wearing a belt around my waist.,0,0,0,0,1
eng_train_track_a_00962,The FUNNIEST Thing I've Seen In AGES Last Chance to See on TVO and ended up with tears streaming down my cheeks because I was laughing so hard.,0,0,1,0,0
eng_train_track_a_00963,"Amanda and I carried the washer up with no problems but as we sat it down in the street, my back gave out.",0,1,0,1,0
eng_train_track_a_00964,"My hand was indeed gone, but new fingers, stubby and underformed, were sprouting from the stub.",0,1,0,1,1
eng_train_track_a_00965,A few years ago I worked for an apartment rental agency in a customer service role.,0,0,0,0,0
eng_train_track_a_00968,He was admiring the tattoo on my forearm.,0,0,0,0,0
eng_train_track_a_00969,We did this like 3 times before we just decided to leave it in the closet.,0,0,0,0,0
eng_train_track_a_00971,""" I figure she probably spent all night hiding in a corner.",0,1,0,1,0
eng_train_track_a_00972,I could see them all.,0,0,1,0,1
eng_train_track_a_00973,I love telling this story.,0,0,1,0,0
eng_train_track_a_00974,"determined well, i've been going to the gym a little over three weeks now, and i've lost eight pounds, and roughly twelve inches total-about three from my waist, two and a half from my hips, a half inch from each thigh, and four total from my... um... upper torso area... anyway, it feels awesome.",0,0,1,0,0
eng_train_track_a_00976,"My heart still flutters when I think about it, it was just amazing.",0,0,1,0,0
eng_train_track_a_00977,"Not too scary, right?",0,1,1,0,1
eng_train_track_a_00979,Pain-I have injured my knee somehow.,0,1,0,1,0
eng_train_track_a_00981,"Not the most unnerving feeling, but the most prominent event in my mind is as follows:",0,1,0,0,1
eng_train_track_a_00985,skudai * < 3 > i can closed my heart and my mind.,0,0,0,0,0
eng_train_track_a_00988,Needless to say I was kind of scared.,0,1,0,0,0
eng_train_track_a_00989,When she woke up the next morning she decided to figure out what the hell had happened.,0,1,0,0,1
eng_train_track_a_00990,My horror unfurls as it whispers my name $ It eyeballs me and holds my gaze; dread rips through my heart as it screams out.,0,1,0,0,0
eng_train_track_a_00992,My parents were confused.,0,1,0,1,1
eng_train_track_a_00993,A song started to loop inside my head.,0,1,1,0,0
eng_train_track_a_00997,"I even tried to sleep sitting up for a bit, that ended when I nearly gave myself whiplash when my head dropped.",0,1,0,0,0
eng_train_track_a_00998,"My room is structured so there are two doors, one to the bathroom, which feeds through to another door in the hallway, and the main door to my room from the same hallway.",0,0,0,0,0
eng_train_track_a_01004,"Originally Posted September 18th, 2007 I walked down the driveway, pushing back the stinging pain that kept trying to force a few tears out of my eyes.",0,1,0,1,0
eng_train_track_a_01006,In retrospect this implied extreme circumstances.,0,1,0,0,1
eng_train_track_a_01007,It was hairless and covered in gray skin.,0,1,0,0,1
eng_train_track_a_01008,it got so bad that in the car on the way home i had to put the air on full blast and put my head down in the car to try to keep it cool so it didn't ich so much.,0,1,0,1,0
eng_train_track_a_01010,Some children came out and cheered me on offering water and slapping my back.,0,0,1,0,0
eng_train_track_a_01012,"""I don't know I don't know I don't know...""",0,1,0,1,0
eng_train_track_a_01013,took the skin off my knuckles an my hand bleeding like hell but i felt kinda better.,0,1,0,1,0
eng_train_track_a_01014,She sat at her Papa's recliner sofa only to move next to me and start clinging to my arms.,0,0,0,0,0
eng_train_track_a_01016,Never saw them again...,0,0,0,1,0
eng_train_track_a_01017,I farted and a little nugget fell out onto the floor.,0,0,1,0,1
eng_train_track_a_01019,One time in high school my friends and I had a dance party in someones basement.,0,0,1,0,0
eng_train_track_a_01020,"I managed to shoehorn myself into the seat but my knees were jammed under the dash, I could barely use the pedals, I couldn't get any proper lock on the steering wheel, my head was poking out of the rollcage and I had no idea of what the rev limits or gears were.",0,1,0,0,0
eng_train_track_a_01021,So it goes on like this for awhile.,0,0,0,0,0
eng_train_track_a_01023,"As stiff as a board, I didn't move an inch except to dart my eyes to my sleeping sister in the bed ten feet away.",0,1,0,0,0
eng_train_track_a_01025,And made worse by her crying because of the embarrassment.,0,1,0,1,0
eng_train_track_a_01026,"My whole body was painful today, especially my arms.",0,1,0,1,0
eng_train_track_a_01031,6 hour old post?,0,0,0,0,1
eng_train_track_a_01034,I found an old sweatshirt on the floor and tied it tightly around my leg.,0,1,0,0,0
eng_train_track_a_01035,It also hurts to turn my neck in any direction.,0,1,0,1,0
eng_train_track_a_01037,"I have major slip ups, like, letting the wrong person close to my heart and getting burned.",0,1,0,1,0
eng_train_track_a_01039,I had never been so scared.,0,1,0,0,0
eng_train_track_a_01040,I pushed those thoughts out of my head and told myself I was being paranoid.,0,1,0,0,0
eng_train_track_a_01041,House almost burned down the weekend they were out of town.,0,1,0,1,1
eng_train_track_a_01042,The stranger crosses the finish line first; the crowd goes wild!,0,0,1,0,1
eng_train_track_a_01047,"Earth Base Delta stopped responding to our calls, and we were left alone in the vast emptiness of space.",0,1,0,1,1
eng_train_track_a_01049,"Still, a creepy happening.",0,1,0,0,1
eng_train_track_a_01050,I need to ice my calf often and try to stay off it... except to occasionally stretch it.,0,1,0,0,0
eng_train_track_a_01054,I brought my head up to the edge of the grass and peered towards the road.,0,0,0,0,0
eng_train_track_a_01055,But not very happy.,0,0,1,1,0
eng_train_track_a_01057,I fought back the tears coming to my eyes.,0,1,0,1,0
eng_train_track_a_01059,"My mouth started buzzing, then fingers, arms and legs.",0,1,0,0,0
eng_train_track_a_01060,Mildly inconvenient but so weird.,0,1,1,0,1
eng_train_track_a_01061,I know with all my heart that taking this job was the right thing to do.,0,0,1,0,0
eng_train_track_a_01063,"`` Then a doctor walked around the corner, and my mouth fell open.",0,0,0,0,1
eng_train_track_a_01064,"the new apples of my eye, as promised.",0,0,1,0,0
eng_train_track_a_01066,The silent one looked increasingly nervous.,0,1,0,0,0
eng_train_track_a_01068,"It's also on the front of my upper legs, the back of my lower legs, and the tops of my feet.",0,0,0,0,0
eng_train_track_a_01070,"Needless to say, none of us slept.",0,1,0,1,0
eng_train_track_a_01072,The Dyatlov Pass Incident.,0,1,0,0,1
eng_train_track_a_01073,"Was a routine trip, 11 miles to RWC motoring and into a southerly wind, more wind than we saw during race time and with the sun straight in my eyes most of the way down.",0,1,0,0,0
eng_train_track_a_01074,Still freaks me out to remember it.,0,1,0,0,1
eng_train_track_a_01075,"All-in-all I had a great time, my back didn't kill me, and I felt great after the game was over.",0,0,1,0,0
eng_train_track_a_01076,My fingers are toes are still tingly.,0,1,0,0,0
eng_train_track_a_01077,My jaw hit the floor and i ran out and bought 4 tickets for the closest show in Philidelphia PA. ( the only non-NY / CA show ) Me and 3 friends pile into a car and leave at 9 am the day of the show for a projected 8 hour drive.,0,0,1,0,1
eng_train_track_a_01081,Now this was even more precious to my heart.,0,0,1,0,0
eng_train_track_a_01084,Someone is in danger.,0,1,0,1,1
eng_train_track_a_01085,"My chest was lighter, my entire body was lighter.",0,0,1,0,0
eng_train_track_a_01087,I know why I got one I have constant allergy symptoms and my head was wet with constant snot.,0,1,0,1,0
eng_train_track_a_01088,So we get there and order some drinks.,0,0,1,0,0
eng_train_track_a_01094,"Being a `` part-time vampire '', hanging by my toes during the morning hours during vacation, I spent a few hours that early morning loading stuff.",0,0,1,0,0
eng_train_track_a_01096,"I would wake up sometime later shaking, perhaps trying to rid myself of the sleep paralysis.",0,1,0,1,0
eng_train_track_a_01097,First: I WANT TO KNOW ABOUT *YOUR* DAY!,0,0,1,0,0
eng_train_track_a_01103,At this point my cousin notices that his house is decorated entirely with circus clowns.,0,1,0,0,1
eng_train_track_a_01111,"This will probably get buried, but here goes:",0,1,0,0,1
eng_train_track_a_01112,The bride floated down the aisle like a pageant queen.,0,0,1,0,1
eng_train_track_a_01113,Instinctively I turned my head to see who was coming in.,0,1,0,0,0
eng_train_track_a_01114,Anyway we've been married almost nine years.,0,0,1,0,0
eng_train_track_a_01115,I did as little as possible with my right hand on Sunday and took a long nap with my hand in an elevated and comfortable position Sunday afternoon.,0,0,0,0,0
eng_train_track_a_01116,"The hike was pleasant enough at first, walking on a slight incline, enjoying the scenery and the multitude of grasshoppers ( sweet jaysis, some of them were soooo big I'm sure they had skeletons ) almost flying into my face every step or so, I thought `` Ah!",0,1,1,0,1
eng_train_track_a_01120,I have many memories of him sitting across from me and sucking on a pig's foot while I wrinkled my nose in disgust.,0,0,0,0,0
eng_train_track_a_01121,"As my friend Steve called for better directions and as he was getting them, I fell again thinking I could break and quickly put my foot on the curb.",0,1,0,1,0
eng_train_track_a_01122,So far in this class my eyes have been opened to the power of writing and the enjoyment it can bring to me.,0,0,1,0,0
eng_train_track_a_01125,It was up-hill to get to school.....and up-hill again walking back home.,0,1,0,1,0
eng_train_track_a_01126,"` Captain, ' Ianto said timidly, poking his head around the door.",0,1,0,0,0
eng_train_track_a_01127,"(yikes, no pun intended--on either count)",0,1,1,0,1
eng_train_track_a_01128,strange that happened to me once long ago.,0,1,0,0,1
eng_train_track_a_01130,The trap door was wide open.,0,1,0,0,1
eng_train_track_a_01131,"But, when I feel the sand under my feet, hear the roar of the waves and the strength of the gulf winds pushing and pulling the water in a sacred motion, all else is gone.",0,0,1,0,0
eng_train_track_a_01134,By the time Tuesday afternoon came my brain was gone.,0,1,0,1,0
eng_train_track_a_01135,here's the problem; i itch so bad i want to rip off my skin.,0,1,0,0,0
eng_train_track_a_01136,and my entire right leg up to my hip was still sleeping.,0,0,0,0,0
eng_train_track_a_01137,"I whirl around, of course, and see nothing.",0,1,0,0,1
eng_train_track_a_01138,"Suddenly another plane was involved, heading for Washington and my heart stopped beating for a few seconds as the implications of what was happening took me to my knees.",0,1,0,1,1
eng_train_track_a_01139,"Images of him dominating in all ways filled my head, haunting my dreams and fueling my fantasies.",0,1,0,1,0
eng_train_track_a_01143,Either way I was scared for my life that day...,0,1,0,0,0
eng_train_track_a_01145,There is so much going threw my head right now it's,0,1,0,0,0
eng_train_track_a_01146,"I went to an off broadway show, which was a wedding.",0,0,1,0,1
eng_train_track_a_01147,"The brace however squeezes my leg flesh out the top and bottom of the brace, and makes my knee cap look like a brain when I straighten my leg, but whatever.",0,0,0,0,0
eng_train_track_a_01148,I politely decline and went home.,0,0,0,0,0
eng_train_track_a_01149,Then I got to a parking lot and got a funny idea in my head to toss it at a car.,0,0,1,0,0
eng_train_track_a_01150,My venomous snake story is less awesome but the end result is the same:,0,1,0,0,0
eng_train_track_a_01151,What demon likes peas?,0,0,0,0,1
eng_train_track_a_01154,I closed my eyes and took a deep breath.,0,1,1,0,0
eng_train_track_a_01156,"She is a nice religious girl, exactly like the one he wanted to be with.",0,0,1,0,0
eng_train_track_a_01157,"My heart is broke, There's nothing to steal.",0,0,0,1,0
eng_train_track_a_01160,The next day I got a tetanus shot.,0,1,0,0,0
eng_train_track_a_01161,Got tired roaming' and bumming' around,0,0,0,1,0
eng_train_track_a_01163,"This leads to the neeed to suffle around and makes my legs fall asleep after not too long, which obviously isn't advisable.",0,1,0,0,0
eng_train_track_a_01164,"this lake... that my feet are now standing in... is not only the lake that Jesus calmed in mark 4, but it is also the very water that Jesus walked on!",0,0,1,0,1
eng_train_track_a_01165,"Just got x-rays, and at least my knee does not appear to be broken ( although they are sending the x-rays to a specialist to be sure ).",0,1,1,0,0
eng_train_track_a_01166,"My dad was in the car, my mom was signing medical consents, and my sister was holding my hand and telling me to breath to keep me calm.",0,1,0,1,0
eng_train_track_a_01168,"Everyone was rather distraught, as he was widely liked and respected.",0,1,0,1,0
eng_train_track_a_01170,"Well, I was being nice and throwing our trash away at Sonic... he started to back up, so I slammed my hands on the front of the car, so he started to pull forward... I laughed, finding it funny, and then I slowly realized that the car was against my shins and my feet were under the bumper of the car.......",0,1,0,0,1
eng_train_track_a_01172,I smoke weed alone I have a tendency to become hungry.,0,0,1,0,0
eng_train_track_a_01174,We cleaned up another 15-20 litres of wine and finished up by the boys lifting the flagon to my mouth while I sculled the last litre or so.,0,0,1,0,0
eng_train_track_a_01175,I wish there was some way to know which dreams were going to come true.,0,1,0,1,1
eng_train_track_a_01178,"It was a call from the company whose offer i had accepted, saying that on the medical check up ( i signed the contract before i went on med.check ); my lungs doesn't seem well.",0,1,0,1,0
eng_train_track_a_01179,"hopeful Six months ago, I stood in a strange new place, my strange new home, in front of a fountain with a shiny penny in my hand.",0,0,1,0,0
eng_train_track_a_01184,"Scariest part is when I couldn't move my body, with my conscious aware of everything and not being able to breathe.",0,1,0,1,1
eng_train_track_a_01185,I cringe because I have a morbid fear of STDs.,0,1,0,0,0
eng_train_track_a_01189,"He happened to be wearing two leather jackets at the time, so the machete only cut halfway through his arm right below the elbow.",0,1,0,1,1
eng_train_track_a_01190,"There isn't a lot left, so I'm going to summarize from this point on.",0,0,1,0,0
eng_train_track_a_01191,"We went out for pizza, everything was grand -- great conversation, no awkwardness -- until a friend of hers came up and started chatting, and then congratulated her on her new boyfriend, etc.",0,1,1,1,1
eng_train_track_a_01193,"""Well I have loads, you can share mine"".",0,0,1,0,0
eng_train_track_a_01196,I pulled a shard of bone out of my mouth.,0,1,0,0,0
eng_train_track_a_01197,"By Sharlyn Guthrie From the sea fate called to me, harmless ` round my ankles danced.",0,0,1,0,0
eng_train_track_a_01202,That is how you single-handedly stop a zombie apocalypse.,0,0,1,0,1
eng_train_track_a_01203,"When I pulled her back in, her hand went to the perfect spot on my chest.",0,0,1,0,0
eng_train_track_a_01204,"When I poked my head in the box to see how they were doing, the other one just let out a single peep!",0,0,1,0,1
eng_train_track_a_01205,"I could still feel glass showering down and now the cut on my head was bleeding pretty badly, I could taste the blood as it ran down my face and mixed with my sweat and hit my lips.",0,1,0,1,0
eng_train_track_a_01207,"The whole class turned to look at me and i felt my cheeks flame up a wonderul crimson colour as I tried to bury my head back into my book, i wanted to look back up take one more glimpse at her but I daren't.",0,1,0,1,0
eng_train_track_a_01208,I was on a date with this woman.,0,0,1,0,0
eng_train_track_a_01210,"The interesting part is, i hear nothing.",0,1,0,0,1
eng_train_track_a_01213,"She staggered backwards, hit her head hard enough on the wall to leave a dent, and slumped down.",0,1,0,1,1
eng_train_track_a_01217,So I got my hand on the Healthy wear powder foundation in creamy beige for $ 3.45.,0,0,1,0,0
eng_train_track_a_01219,for puttin my heart into it n come out cryin n sad.,0,0,0,1,0
eng_train_track_a_01220,His life was hell.,0,1,0,1,0
eng_train_track_a_01221,The waiter obliged though and did box the salad.,0,0,1,0,0
eng_train_track_a_01222,And soon well need more cabbage and potatoes.,0,0,0,0,0
eng_train_track_a_01225,I still have a blank stare on my face.,0,0,0,0,0
eng_train_track_a_01229,it's currently snowing big flakes outside and i'm crossing my fingers and hoping for a snow day.,0,1,1,0,0
eng_train_track_a_01231,She never went through general anesthesia again.,0,1,0,1,0
eng_train_track_a_01238,Thoight it was weird.,0,1,0,0,1
eng_train_track_a_01242,"Makeing a sorta clam shell, or like someone praying but sideways., around my clentched fist.",0,1,0,0,0
eng_train_track_a_01244,I woke up around 10:30 with a million thoughts rolling through my head.,0,1,0,0,0
eng_train_track_a_01247,We've never met.,0,0,0,0,1
eng_train_track_a_01251,"Oh, this thread is perfect.",0,0,1,0,0
eng_train_track_a_01252,Tears streaming down my face I say '' let this end be because of my own making. '',0,1,0,1,0
eng_train_track_a_01253,Every september I used to get a wicked case due to fluid in my ears caused by allergies.,0,1,0,1,0
eng_train_track_a_01255,""" We don't have anything that they want, so they told me.",0,1,0,1,1
eng_train_track_a_01256,She lived in the boonies &amp; one night she was getting ready for bed when she glanced out the window &amp; saw a red flicker.,0,1,0,0,1
eng_train_track_a_01258,"I then started to cry again, with a doll in my arms.",0,0,0,1,0
eng_train_track_a_01260,I was sweating and panicked.,0,1,0,0,0
eng_train_track_a_01261,Meaningless at the time.,0,0,0,1,0
eng_train_track_a_01262,"It was dark but I could see my door was slightly open, and on the other side was from what I could tell a giant eye.",0,1,0,0,1
eng_train_track_a_01263,In college we had a lot of foreign students at school.,0,0,1,0,0
eng_train_track_a_01264,It was really beautiful but being half asleep I didn't want to wake up anymore and so I kept dozing in and out of sleep watching the sunrise for a few moments before closing my eyes again and drifting off to sleep.,0,0,1,0,0
eng_train_track_a_01267,"It was a joyously frightening ride and as I went to get off the bike, I burned my leg on the exhaust.",0,1,1,0,0
eng_train_track_a_01268,"""That's were those people went missing"".",0,1,0,1,1
eng_train_track_a_01269,It was so fucking weird.,0,1,0,0,1
eng_train_track_a_01270,"Jamming the finger in my mouth to suck on, I open my stinging eyes and look over to my nightstand.",0,1,0,1,0
eng_train_track_a_01271,"), and I've imagined an entire life for him, his family, and his friends.",0,0,1,0,0
eng_train_track_a_01272,I remember Pirate Percy.,0,0,1,1,0
eng_train_track_a_01274,I shook my head.,0,0,0,0,0
eng_train_track_a_01276,"Nothing in his bed, not on his pillow, not on the bed, not on any doorhandles...nothing.",0,1,0,1,1
eng_train_track_a_01278,What happened to my heart when it broke into pieces?,0,0,0,1,0
