id,text,anger,fear,joy,sadness,surprise
eng_train_track_a_01722,I think it gets me into less trouble to be able to type but still keep my eyes and face turned to my teacher.,0,1,0,0,0
eng_train_track_a_01723,"But in searching for some other sound to train my ears on, I realized there was no sound coming from Grandma.",0,1,0,0,1
eng_train_track_a_01724,"Not a cop, but...",0,1,0,0,1
eng_train_track_a_01725,My jaw dropped as I squealed with delight.,0,0,1,0,1
eng_train_track_a_01727,"The blood blinded my eyes as it ran down to my cheeks, and I tasted the sweetest flavor.",0,1,0,0,1
eng_train_track_a_01729,accomplished I went and got my eyes checked today.,0,0,1,0,0
eng_train_track_a_01731,"I live completely alone, and as I pull the popcorn out of the pantry, I hear an ominously distinct ""SSSSHHHH"" sound.",0,1,0,0,1
eng_train_track_a_01732,"I had twisted my ankle too, and I cried out in pain.",0,1,0,1,1
eng_train_track_a_01734,The second turned out to be clinically depressed.,0,1,0,1,0
eng_train_track_a_01738,"Total: 80.5 miles ( 10,550 ' ) My legs felt great all week, which is really encouraging considering this is the first week of the taper.",0,0,1,0,1
eng_train_track_a_01743,"I became fixated and fascinated with abduction stories, with The X-Files, etc., for years.",0,1,1,0,0
eng_train_track_a_01745,I did nt notice it until it crawled all over my hand like a maniac.,0,1,0,0,1
eng_train_track_a_01747,But this is August.,0,0,0,0,1
eng_train_track_a_01748,I figure it must have fallen out.,0,1,0,0,1
eng_train_track_a_01750,"People just aren't buying CD's any more. When J. Warren, former owner of Vibes music, spoke these words, my heart sunk a little in my chest.",0,0,0,1,0
eng_train_track_a_01751,One drink down and she was blackout drunk.,0,1,0,1,1
eng_train_track_a_01754,"There was nothing I could do, all things were over Tears were starting to flow from my eyes.",0,1,0,1,0
eng_train_track_a_01757,Totally forgot to add: I'm straight.,0,0,0,0,1
eng_train_track_a_01759,Was I drunk or a kid?,0,1,0,0,1
eng_train_track_a_01760,"Recollecting all the things, happy or unhappy, in Australia I have gone through, word bitter pops up in my head.",0,0,0,1,0
eng_train_track_a_01761,Over the years I have taken pictures of what caught my eye.,0,0,1,0,0
eng_train_track_a_01763,"No sidewalk, just a simple two way, single lane street with crazy traffic going either direction.",0,1,0,0,0
eng_train_track_a_01764,He's just a super nice guy who wants to help girls out all while being respectful.,0,0,1,0,0
eng_train_track_a_01768,Now I can't wait to get my hands on all that wall space!!!,0,0,1,0,0
eng_train_track_a_01769,"A couple of years later (two years ago), Grandma was stricken with a sudden, serious illness and was given a short time left to live.",0,1,0,1,0
eng_train_track_a_01771,I have a cold that has decided to settle in my throat.,0,1,0,0,0
eng_train_track_a_01773,My roommate was asleep in his bed.,0,0,0,0,0
eng_train_track_a_01774,I had soup and applesauce with pudding for dessert.,0,0,1,0,0
eng_train_track_a_01775,This was the most random/terrifying thing that has ever happened to me.,0,1,0,0,1
eng_train_track_a_01777,We've been friends ever since then.,0,0,1,0,0
eng_train_track_a_01778,Not fifteen minutes into class my stomach started hurting.,0,1,0,1,0
eng_train_track_a_01780,"Dont wait, or say a single vow.",0,1,0,1,0
eng_train_track_a_01781,I was incredibly nervous; I had butterflies in my stomach and my legs felt weak.,0,1,0,0,0
eng_train_track_a_01782,"*Creepy/unnerving* that is, and just weird.",0,1,0,0,1
eng_train_track_a_01784,So... for reasons unknown...,0,1,0,0,1
eng_train_track_a_01785,I now have 12 of those canker sore suckers in my mouth along with a fever since friday.,0,1,0,1,0
eng_train_track_a_01786,"And my ears are stuffed and I can't blow my nose, and I woke up today with the most terrible headache and everything's too hot.",0,1,0,1,0
eng_train_track_a_01787,I did settle down and dry my eyes on my sleeve.,0,0,0,1,0
eng_train_track_a_01788,"I crossed my arms, smiled, tilted my head, and said, `` I thought you were supposed to be in Austria? ''",0,0,1,0,0
eng_train_track_a_01789,wanted to quickly go home and hide my face.,0,1,0,1,0
eng_train_track_a_01790,"And this tradition keep on, every time billy made it to class we would clap and cheer :) until he died.",0,0,1,1,0
eng_train_track_a_01791,Edward rid me of my distraction by biting my shoulder.,0,1,0,0,0
eng_train_track_a_01792,but both well adjusted and successful in our perspective careers.,0,0,1,0,0
eng_train_track_a_01793,Only then did I dare raise the camera to my eye.,0,1,1,0,0
eng_train_track_a_01794,The thing I neglect to mention though.,0,1,0,0,1
eng_train_track_a_01795,"I didn't know what to say, but my nerves were all on edge, straining.",0,1,0,0,0
eng_train_track_a_01796,"He got the location, car make/model/year/color correct, manner of impact, impacting vehicle, everything correct.",0,0,1,0,1
eng_train_track_a_01797,My friend said to get to work on my tooth since I was sitting there ready to go.,0,0,0,0,0
eng_train_track_a_01798,No kids were hurt.,0,0,1,0,0
eng_train_track_a_01799,I felt the sadness like a heaviness-a weight on my heart.,0,0,0,1,0
eng_train_track_a_01800,she is an alcoholic.,0,1,0,1,0
eng_train_track_a_01802,"So I got up so I could pee, sat down and proceeded to throw up all over my legs and underwear.",0,1,0,1,0
eng_train_track_a_01807,"like seriously, alot can not understand and im slow at registering words in my brain during that time, so yeah.",0,1,0,1,0
eng_train_track_a_01808,"I abruptly ""woke up"" again out of sleep-paralysis in a state of crazy shock.",0,1,0,0,1
eng_train_track_a_01809,"We stayed in a really lovely hotel-I had two sinks in my bathrooms and white dressing gowns and clippers, any hotel which provides dressing gowns is a good hotel in my eyes.",0,0,1,0,0
eng_train_track_a_01811,"v-neck shirt, I moved slowly throughout the house, doing my usual morning duties ( diaper changes, breakfast, coffee ), quite lethargically, occasionally brushing a strand of ( dirty ) hair away from my eyes with my hand.",0,0,0,1,0
eng_train_track_a_01812,The very last final I had to take for the semester.,0,1,0,0,0
eng_train_track_a_01813,In about 45 minutes I get to go have a camera stuck down my throat to confirm the existance of the ulcer.All that and we are supposed to leave a week from today and fly to CO..,0,1,0,1,0
eng_train_track_a_01815,"I chuckled, holding my hands up, and sat down in my comfy swivel chair.",0,0,1,0,0
eng_train_track_a_01816,"Second time, been together 6 mo.",0,0,1,0,0
eng_train_track_a_01817,This guy was interested in me.,0,0,1,0,1
eng_train_track_a_01818,"I'm sitting up and not going anywhere, basically half-way through the tube.",0,1,0,0,0
eng_train_track_a_01820,"Unfortunately in the second hour, I took an odd stroke and my neck popped.",0,1,0,1,0
eng_train_track_a_01825,sorry for spelling and stuff.,0,0,0,0,0
eng_train_track_a_01827,My eyes were staring at the floor as I said this.,0,1,0,1,0
eng_train_track_a_01828,The whole store erupted into cheering and applause.,0,0,1,0,1
eng_train_track_a_01830,"We hit something as we slide into the side of the road, my eyes flashed open and the car took flight into the trees, now straight ahead of us.",0,1,0,1,1
eng_train_track_a_01832,Before I knew it I was on my hands and knees and someone close to me let out a terrible grunt at the same time.,0,1,0,0,0
eng_train_track_a_01833,"And without even stopping to think about it, I tuck one of those boxes under my arm and go back to the living room.",0,0,1,0,0
eng_train_track_a_01834,A stranger is running alone in the park.,0,1,0,0,0
eng_train_track_a_01835,"Normally I need a change every year, but or the past six years or so, I've been changing my glasses every 2 since my eyes are slacking off some.",0,1,0,0,0
eng_train_track_a_01836,Her face.... Was priceless.,0,0,1,0,1
eng_train_track_a_01838,"So , I spent the whole day staring out of my bedroom window close to tears, which says a lot because I don't cry easily.",0,1,0,1,0
eng_train_track_a_01841,"There was an awkward, frozen moment as we all acknowledged each other and as my brain scrambled to make sense of this ""hallucination"".",0,1,0,0,1
eng_train_track_a_01844,Luckily for me I have to use the restroom every 15 minutes so midway through our appointment I was already trying to cross my legs again.,0,1,0,0,0
eng_train_track_a_01845,"As a caretaker, this freaked me out to no end.",0,1,0,0,0
eng_train_track_a_01846,A knock on the door and my heart litarely stopped for a good three seconds.,0,1,0,0,1
eng_train_track_a_01847,"I arrived at Penny's doorstep, tears streaming down my face.",0,1,0,1,0
eng_train_track_a_01848,"I hung my head in shame, feeling like the lowest of mothers.",0,1,0,1,0
eng_train_track_a_01849,"And now that we are back, I just feel drained and my calves hurt.",0,0,0,1,0
eng_train_track_a_01850,"I took my eye away from the camera and found the little guy ( or little girl, can't really tell ) a few feet above me now.",0,0,0,0,0
eng_train_track_a_01851,"I needed to come out of a parking lot on the side of the highway and then pull the car up to a high speed so as not to have an accident/annoy highway drivers, so I was pretty nervously sitting there, waiting for the right opportunity.",0,1,0,0,0
eng_train_track_a_01852,But there was peace in my heart.,0,0,1,0,0
eng_train_track_a_01853,I closed my eyes and tried my best to ignore it and i eventually ended up falling asleep.,0,1,0,0,0
eng_train_track_a_01854,That's super weird.,0,1,0,0,1
eng_train_track_a_01855,My disbelief was outstanding.,0,0,0,0,1
eng_train_track_a_01856,"I went to the doctor today to get my ears cleaned...-I got my ears `` Flushed '' because I did have a problem, and it was too close to a dangerous area.",0,1,0,0,0
eng_train_track_a_01857,I drew my robes around me tightly as my legs kept walking to no particular destination.,0,1,0,1,0
eng_train_track_a_01861,"and Christian fish bumper stickers, it caught my eye and made me grin.",0,0,1,0,1
eng_train_track_a_01862,"I stopped for water at the rest stops and got doused with a hose, which was very pleasant except my shoes got drenched so I was running with heavy sponges on my feet for the last two miles.",0,1,0,0,0
eng_train_track_a_01865,"I would always be downloading more music and burn it on new, cheap cds.",0,0,1,0,0
eng_train_track_a_01869,"It was a branch line to a gravel quarry, so the three or four daily trains moved slowly.",0,0,0,0,0
eng_train_track_a_01870,I didn't hesitate to leap to my feet.,0,0,1,0,0
eng_train_track_a_01872,He took the picture and followed the giggling.,0,1,1,0,1
eng_train_track_a_01874,It also happened to be raining on that day.,0,0,0,0,0
eng_train_track_a_01878,So no surgery due to blood clot because I have to take injections and pills to thin my blood way out so the clot doesn't break off and go to my lungs or brain.,0,1,0,1,0
eng_train_track_a_01879,"I woke up, brushed my teeth, and started to play a little maple story.",0,0,1,0,0
eng_train_track_a_01881,"He was then hit by congestive heart failure, fell into a coma, and passed away.",0,1,0,1,1
eng_train_track_a_01882,"My eyes constantly throbbed from being so dry, even though there always seemed to be tears to cry at night.",0,1,0,1,0
eng_train_track_a_01885,When something caught my eye.,0,0,0,0,1
eng_train_track_a_01886,I love you boy.,0,0,1,0,0
eng_train_track_a_01888,I opened my eyes.,0,0,1,0,0
eng_train_track_a_01890,I was quite sad.,0,0,0,1,0
eng_train_track_a_01891,"He bought the first beer, and before it was even gone I had a new full one in my hand!",0,0,1,0,0
eng_train_track_a_01892,He was very weird.,0,1,0,0,1
eng_train_track_a_01894,"Except, I don't fall unconscious.",0,1,0,0,1
eng_train_track_a_01899,"One particular experience I had at a place called ""Hernando's Bridge"", however, still scares me to this day.",0,1,0,0,1
eng_train_track_a_01901,"See, thats the thing, Sean wasnt an alcoholic.",0,0,0,0,1
eng_train_track_a_01905,My muscles all relax With the feeling of an empty hand and no pedals beneath my feet.,0,0,1,0,0
eng_train_track_a_01907,I was totally and completely fine with the fact that I had just been bludgeoned with a trampoline $ until I saw the blood; the 57 gallons of blood that proceeded to spew out of my face and cover my tiny little body.,0,1,0,1,1
eng_train_track_a_01908,The spring sun was just rising and his car was already ripping down the highway.,0,1,1,0,1
eng_train_track_a_01909,"I stretched out my arms for balance, and bounced more vigorously.",0,0,1,0,0
eng_train_track_a_01913,So I spent most of lunch at the college trying very hard to concentrate on my botany book and not stare at people with a vacant expression on my face.,0,1,0,0,0
eng_train_track_a_01915,"( I was smart & bit my tongue ) Oh, and great results, but I'm not going into details... ow.We spent all day together, and got pizza & a ton of beer for dinner!",0,0,1,0,0
eng_train_track_a_01916,They also had to flush out my eyes ( which i had had closed the ENTIRE time ) cause they had glass in them.,0,1,0,1,0
eng_train_track_a_01918,None of us has mentioned the incident since.,0,1,0,1,1
eng_train_track_a_01919,This happened like 10 years ago.,0,0,0,0,1
eng_train_track_a_01920,They no longer live there.,0,0,0,1,0
eng_train_track_a_01921,"The stranger is left speechless, confused, and strangely proud.",0,1,1,0,1
eng_train_track_a_01923,"Callie takes attention at my tone, having probably gotten used to my mumbled thanks in response to all of the attendees who had already been by, and she places her hand protectively at the base of my spine.",0,0,1,0,0
eng_train_track_a_01924,The light would come all the way up to your vehicle and then it would seem to vanish only to be on the other side of you heading the other way.,0,1,0,0,1
eng_train_track_a_01926,So I'm racking my brain.,0,1,0,0,0
eng_train_track_a_01927,I still cannot explain this.,0,1,0,0,1
eng_train_track_a_01928,"Now he's sobbing and screaming, finally defeated.",0,1,0,1,0
eng_train_track_a_01929,"It made an odd 'thap' noise, you know...",0,1,0,0,1
eng_train_track_a_01930,The waitress had physical therapy experience and prepared a nice bag of ice for my ankle and the beer was FANTASTIC!,0,0,1,0,0
eng_train_track_a_01931,"Then suddenly, she heard a strange thump; but looking around saw nothing.",0,1,0,0,1
eng_train_track_a_01933,"I knew there were bits on this section I had struggled with, like the massive drop offs ( okay, maybe not massive, but they seemed massive to me ) and the steep switchbacks, but again I managed to avoid the urge to grab handfuls of brakes and shut my eyes, and I forced myself to ride the first big drop off and the next few were suddenly much less scary.",0,1,1,0,0
eng_train_track_a_01935,"""Are you sure, sis?",0,1,0,0,1
eng_train_track_a_01936,Kick my heels up and shout.,0,0,1,0,0
eng_train_track_a_01937,my mum had complained to my step dad about feeling uneasy.,0,1,0,1,0
eng_train_track_a_01938,"You could not see a foot in front of you and I practically cried getting to the bottom because the wind and snow was literally burning my face, lol.",0,1,0,1,0
eng_train_track_a_01939,I am exhausted and my back is hurting along with my throat.,0,1,0,1,0
eng_train_track_a_01940,"It could have been slaughter, but he turned his wheel.",0,1,0,0,1
eng_train_track_a_01942,I totally freaked out.,0,1,0,0,1
eng_train_track_a_01944,I feel it slithering down my skin like a anaconda snake.,0,1,0,0,1
eng_train_track_a_01945,That one was probably the weirdest.,0,0,0,0,1
eng_train_track_a_01946,"After I rationalized a bit, I calmed down.",0,1,1,0,0
eng_train_track_a_01947,The barn is full of corpses.,0,1,0,1,1
eng_train_track_a_01951,Well I have the bright idea that I need to stop being like this and I end up alone on the elevator with this girl.,0,1,1,1,1
eng_train_track_a_01953,"The Spot on my ear was bot good, but not alarming.",0,0,0,0,0
eng_train_track_a_01954,Thankfully I never went through with it.,0,1,1,0,0
eng_train_track_a_01955,Scared me shitless each time it happened.,0,1,0,0,1
eng_train_track_a_01957,I literally hid my face and my whole self.,0,1,0,1,0
eng_train_track_a_01958,""" and look in my rear view mirror.",0,1,0,0,0
eng_train_track_a_01960,It was hung at a very strange angle.,0,1,0,0,1
eng_train_track_a_01962,"She grinned toothlessly and with a cackle, spoke: Now your *third* wish.",0,1,0,0,1
eng_train_track_a_01965,"I began to start running away again, but I tripped and fell flat on my back.",0,1,0,1,0
eng_train_track_a_01966,The other night I was on my way to bed and I stopped in the bathroom to brush my teeth.,0,0,0,0,0
eng_train_track_a_01967,"This'll probably get buried, but what the hell?",0,0,0,0,1
eng_train_track_a_01968,"Somehow, with visions of doll masks and pocket 6s dancing my head, I still managed to fall asleep.",0,1,0,0,1
eng_train_track_a_01970,Then proceeded to duck and run past him into the female restroom.,0,1,0,0,1
eng_train_track_a_01974,I was very scared.,0,1,0,0,0
eng_train_track_a_01979,"I whimpered, and my heels started pounding against the hardwood floor.",0,1,0,0,0
eng_train_track_a_01980,"Not a completely awful birthday, but my worst.",0,0,1,1,0
eng_train_track_a_01981,My heart is heavy for the Haitian government.,0,0,0,1,0
eng_train_track_a_01984,"She found her Dad and gave him a rock she had found out side, just a plain old rock.",0,0,1,0,0
eng_train_track_a_01985,"Navy, Air Traffic controller.",0,0,0,0,0
eng_train_track_a_01986,"I should interject here, that I prayed on my knees at the alter for a diagnosis at the church of the nazarene-ONE week before this happened... and then three days ago, my doctor sat me down and showed me my lab tests and gave me the pheochromocytoma word, and the two specialist referrals, looked at me and said `` I'm going to get you your life back.",0,1,1,1,0
eng_train_track_a_01989,"he kept talking, but i couldn't hear anything but my heart exploding inside my chest, the grand finale.",0,1,0,0,0
eng_train_track_a_01990,3rd I really don't know... Any of the main characters really..,0,1,0,0,0
eng_train_track_a_01991,I covered my face with my hands.,0,1,0,1,0
eng_train_track_a_01992,"Probably just going to be buried, but at least I can tell this story somewhere.",0,0,0,1,0
eng_train_track_a_01994,"and the stains, across my heart.",0,1,0,1,0
eng_train_track_a_01996,I got there about 7:00 a.m. and started losing up my legs and doing some yoga.,0,0,1,0,0
eng_train_track_a_01997,"Now, mental illness runs in my family, from fairly ""common"" stuff like depression and anxiety (which I have) to dissociative identity disorder, borderline personality disorder, and schizophrenia.",0,1,0,1,1
eng_train_track_a_01998,My legs are feeling the effects right now.,0,0,0,1,0
eng_train_track_a_02001,This bracelet just falls to the ground.,0,1,0,0,1
eng_train_track_a_02004,"I seated some where, and just about to open my story book, my eye caught a glimpse of someone standing right do nt even know... Walk to library.",0,1,0,0,1
eng_train_track_a_02005,"Sitting around a few years ago with about 5 friends at my best friends house, i'm watching someone play ps2 and i notice a hand reach out from between the t.v.",0,1,0,0,1
eng_train_track_a_02007,I followed the direction it went thinking it was my friend.,0,1,0,0,1
eng_train_track_a_02009,I will never forget hat day.,0,0,0,1,1
eng_train_track_a_02012,"So I left the room, went outside and settled once again for going through my mess in my head.",0,1,0,1,0
eng_train_track_a_02013,I walked out kamiyacho station with a big question mark in my head.,0,1,0,0,1
eng_train_track_a_02015,"Circus clown wallpaper, circus clown figurines, paintings of circus clowns, small statues of circus clowns.",0,1,0,0,1
eng_train_track_a_02016,"this is why i get up every day, lace up my chucks and keep a smile on my face through all sorts of patron issues.",0,0,1,0,0
eng_train_track_a_02017,and that got my head bobbing a little bit.,0,0,1,0,0
eng_train_track_a_02018,The shock burned a part of my thumb.,0,1,0,1,1
eng_train_track_a_02019,Never trust a fart.,0,1,1,0,0
eng_train_track_a_02020,(It was pretty bad).,0,1,0,1,0
eng_train_track_a_02022,"Still starved for human interaction, I say okay.",0,1,0,1,0
eng_train_track_a_02023,"The room really isn't a room, it is as though she is kneeling on the floor but I don't see any walls.",0,1,0,0,1
eng_train_track_a_02027,"My stomach twisted for some reason, instinct telling me that it was Lacie he was talking to.",0,1,0,0,0
eng_train_track_a_02031,"Between moving appliances yesterday at work, and this morning where I tensed enough to tweak my back, I'm a bit sore.Now Paka has been staring at me wide-eyed and giving her whining-style meow.",0,0,0,1,0
eng_train_track_a_02032,"I didn't leave town this weekend, knowing it was going to rain ( thus my volunteer day today w / the homeless ) whilst my shoulder is all jacked up and clicking.I think I pinched at nerve at the gym.",0,1,0,1,0
eng_train_track_a_02033,"My hands, my lips, my touch These and are few to what it takes To build something no one can imagine.",0,0,1,0,0
eng_train_track_a_02037,I can never forget it.,0,1,0,1,0
eng_train_track_a_02040,"As I jogged down the street, I noticed that the snow was blowing straight into my eyes.",0,1,0,0,1
eng_train_track_a_02043,rage.. violence... threats until I leave the house... then she bounces back... goes dancing and has sex with a stranger and tells me about it.,1,1,0,1,1
eng_train_track_a_02045,"I guess I should learn to just not open my mouth, because this morning when I woke up, I was in Minnesota!!",0,0,0,0,1
eng_train_track_a_02046,They said they don't remember any man.,0,1,0,1,1
eng_train_track_a_02048,"But my natural color, on the underside of my forearms for example, is `` dead fishbelly white.",0,0,0,0,0
eng_train_track_a_02050,"in january i dropped some dead weight, which relieved my back a little from carrying other peoples problems around too much.",0,1,1,0,0
eng_train_track_a_02051,We cuddled on the couch whilst watching TV.,0,0,1,0,0
eng_train_track_a_02052,"Chef is a title like ""supervisor"" or ""manager"".",0,0,0,0,1
eng_train_track_a_02053,Nobody on the other end.,0,1,0,0,1
eng_train_track_a_02054,"To this day, I can't go to the doctor without maniacally spelling `` vaccinations '' in my head, just to make sure I remember how.",0,1,0,0,0
eng_train_track_a_02056,They check out the whole house and say it's clear to go back inside.,0,1,1,0,0
eng_train_track_a_02057,"Quite full in my heart actually, for affirming this man, so lovingly, and fearlessly.",0,0,1,0,0
eng_train_track_a_02063,Just helping a kid.,0,0,1,0,0
eng_train_track_a_02065,Charlie was so crazy!,0,0,1,0,1
eng_train_track_a_02068,My brain's dead weight I'm tryin to get my head straight but I can't figure out which Cheerleader i wan na impregnate.,0,1,0,1,0
eng_train_track_a_02070,I'll explain myself...,0,1,0,0,0
eng_train_track_a_02073,"Right now I am doing the pain killers, and quad exercises, with the proviso that we keep a close eye on the damage already done to my knee.",0,1,0,0,0
eng_train_track_a_02076,**I have an amazing I-called-that sports story that defies explanation.,0,0,1,0,1
eng_train_track_a_02078,It frames my face and makes me look rather clownish.,0,0,0,1,0
eng_train_track_a_02079,It's pretty crazy thinking of the random chance of us never meeting.,0,0,1,0,1
eng_train_track_a_02080,A week later he had a girlfriend.,0,0,1,1,1
eng_train_track_a_02081,i told myself i can't buy anything yet my hand just cant stop me for buying.,0,1,0,0,0
eng_train_track_a_02082,Then buy a farm.,0,0,1,0,0
eng_train_track_a_02083,"I would be about 10 maybe, anyway i was out with my mom , dad and sister.",0,0,1,0,0
eng_train_track_a_02084,"In my head I just said, ""this is going to end badly.",0,1,0,1,0
eng_train_track_a_02085,Hence the goofy grin on my face.,0,0,1,0,0
eng_train_track_a_02089,In a car crash.,0,1,0,1,1
eng_train_track_a_02093,"Anyway, a dream glitch?",0,1,0,0,1
eng_train_track_a_02095,None of us did.,0,0,0,0,0
eng_train_track_a_02099,Over two hours gone.,0,1,0,1,1
eng_train_track_a_02102,"We didn't swing, we just rested and enjoyed the weather.",0,0,1,0,0
eng_train_track_a_02104,I just realized that I have stitches in my mouth.,0,1,0,0,0
eng_train_track_a_02106,"Finally facing life responsibilities again, but my head still was on vacation.",0,1,0,0,0
eng_train_track_a_02109,Then again but harder.,0,0,0,0,0
eng_train_track_a_02110,""" and burst out laughing.",0,0,1,0,1
eng_train_track_a_02111,"I hit it again, another familiar value came up.",0,0,1,0,1
eng_train_track_a_02113,"WANTED to go more like 13, but my heel was a little sore from last weeks `` heavier '' mileage, so I did the smart thing ( I think ) and cut it short.",0,1,0,0,0
eng_train_track_a_02116,The most solid relationship in my whole life started with Zelda and Mario!,0,0,1,0,1
eng_train_track_a_02118,"It didn't hurt at the time, but I was getting a headache and my head started feeling really heavy!",0,1,0,1,0
eng_train_track_a_02119,"I'm still feeling woozy, it's hard to type because my muscles are not cooperating with me.",0,1,0,0,0
eng_train_track_a_02121,so I'm stir my heart for Europe travel.,0,0,1,0,0
eng_train_track_a_02123,My last relationship ended pretty mutually...and I really tried to maintain the friendship.,0,0,1,1,0
eng_train_track_a_02125,All at once we play.,0,0,1,0,0
eng_train_track_a_02126,I actually started to look forward to that because of the flying sensation.,0,0,1,0,0
eng_train_track_a_02127,"I spent the night in my room, then went to bed.",0,0,0,0,0
eng_train_track_a_02128,I sleep facing away from my door.,0,1,0,0,0
eng_train_track_a_02129,i'm going to meet your sister.,0,1,1,0,0
eng_train_track_a_02132,"I tilted my head to the side and smiled, `` I know you are.",0,0,1,0,0
eng_train_track_a_02133,"In the past, whenever I've gained weight, it went straight to my hips.",0,0,0,0,0
