id,text,anger,fear,joy,sadness,surprise
eng_train_track_a_01280,"I've spent tons of time in the desert, in the forest, camping, hiking.",0,0,1,0,0
eng_train_track_a_01282,"Not too long after my family left, a guy came in to hook me up to yet another machine briefly to check my breathing which proved to be labored but not dangerously slow ( a nurse came in later a gave me a little toy thing to exercise my lungs which helped a bit ) and another couple guys came in to take an x-ray of my lungs.",0,1,0,0,0
eng_train_track_a_01283,The pain was incredible.,0,1,0,1,0
eng_train_track_a_01285,I started smoking there.,0,0,0,0,0
eng_train_track_a_01287,"I pushed her away, looked at the other pups, played, and did all the little `` tests '' but, every time someone turned loose of that the little female pup, she simplly walked over, and crawled in my lap, licked my hand.",0,0,1,0,0
eng_train_track_a_01288,I used to work for a UK energy company and through asking the right people the right questions I learned about the distribution gap.,0,0,1,0,0
eng_train_track_a_01289,"During the long and high vocals at the end, hair stood up on the back of my neck.",0,1,0,0,1
eng_train_track_a_01290,I think my eyes shut immediately after my head hit that pillow.,0,0,1,0,0
eng_train_track_a_01293,where my feet couldn't get warm enough while i slept and i had to wear booties while sleeping.,0,1,0,0,0
eng_train_track_a_01294,It buoyed up my heart.,0,0,1,0,0
eng_train_track_a_01297,"""Liutenant, we see the black patch.",0,1,0,0,1
eng_train_track_a_01300,"I throw my hands up in the air sometimes Sayin ' ay-oh, got ta let go I wan na celebrate and live my life Sayin ' ay-oh, baby let's go 'Cause we gon ' rock this club We gon ' go all night We gon ' light it up Like it's dynamite 'Cause I told you once Now I told you twice We gon ' light it up Like it's dynamite God, I wish I could.",0,0,1,0,0
eng_train_track_a_01301,""" I explain the promotion to them and he is quick to decide he wants three.",0,0,1,0,1
eng_train_track_a_01302,"I fell to my knees, my body shaking with the sorrow I held in me since I woke up.",0,0,0,1,0
eng_train_track_a_01303,For many months I learned to shower keeping my elbows close to prevent water from hosing off the ends and totally drenching the place.,0,1,0,0,0
eng_train_track_a_01305,Maybe I should try to get my hands on some.,0,0,0,0,0
eng_train_track_a_01308,I go in and sit down at my usual seat.,0,0,0,0,0
eng_train_track_a_01309,"`` Well then, by all means, curl my toes. ''",0,0,0,0,0
eng_train_track_a_01310,"Ah, to close my eyes and let time fly by, Because there's so much to gain By forgetting these dreams driving me insane.",0,1,0,1,0
eng_train_track_a_01311,It started out like a small ache but as the day progressed it turned into this sharp jabbing pain in my ear.,0,1,0,0,0
eng_train_track_a_01312,I most certainly had change.,0,0,0,0,0
eng_train_track_a_01314,Quite the opposite-total sloth/stoner/drunk.,0,0,0,0,1
eng_train_track_a_01315,We haven't talked about it since.,0,0,0,1,0
eng_train_track_a_01316,"My arms reached forward, and I grabbed on to his leg.",0,0,0,0,0
eng_train_track_a_01318,"Now, we just gotta get it home.",0,0,1,0,0
eng_train_track_a_01319,=D but i took the ones written on my hands one!,0,0,1,0,0
eng_train_track_a_01325,What was the aftermath?,0,1,0,0,1
eng_train_track_a_01326,"At this point I am starting to have an anxiety attack, but I keep listening.",0,1,0,0,0
eng_train_track_a_01331,i oblige and he says something about how i have fluid in my lungs and i need to cough it all out.,0,1,0,0,0
eng_train_track_a_01333,Sometimes I have difficulty feeling my feet-I much prefer the clouds.,0,1,0,0,0
eng_train_track_a_01339,"No noise at all, no lights, it wasn't pitch black either.",0,1,0,0,1
eng_train_track_a_01340,At least not right away.,0,0,0,0,1
eng_train_track_a_01343,"I witnessed as the age old rock tradition of holding up lighters spread across the 28,000 person deep crowd... lighting up the entire audience... the hair on my arms started to raise until I noticed that....",0,1,1,0,0
eng_train_track_a_01345,"Stretching until my toes were caught by the sheets and my fingertips brushed the headboard, I opened my eyes.",0,0,1,0,0
eng_train_track_a_01346,It hadn't been plugged in and cell phones keep time automatically.,0,0,0,0,1
eng_train_track_a_01347,"light and noise, they make my brain pound against my skull.",0,1,0,0,0
eng_train_track_a_01354,You've clearly been to hell and back.,0,1,0,1,0
eng_train_track_a_01355,I said sure thing.,0,0,1,0,0
eng_train_track_a_01358,Then it hit me.,0,1,0,0,1
eng_train_track_a_01361,"""Yes Johnson"" ARcH replied.",0,0,0,0,1
eng_train_track_a_01362,The computer screen is really bright and it hurts my eyes.,0,1,0,0,0
eng_train_track_a_01363,Let's go back to the gym.,0,0,1,0,0
eng_train_track_a_01368,Silence echoed in my head.,0,1,0,1,0
eng_train_track_a_01369,"My eyes followed, noting that there was just the two of us.",0,0,0,0,0
eng_train_track_a_01370,"Clearly, I need to get back on some technical trails and regain my footing there: ) My ankles have been spoiled on the easy pavement this winter!",0,0,1,0,0
eng_train_track_a_01371,"And this charming, gorgeous, blonde struck up a conversation with me.",0,0,1,0,1
eng_train_track_a_01372,It would be her first great grandchild.,0,0,1,0,1
eng_train_track_a_01373,I just sat there panting and wiping tears and mucus off my face.,0,1,0,1,0
eng_train_track_a_01375,I turned to take a good look at the pictures and my jaw almost bounced off the kitchen floor.,0,1,1,0,1
eng_train_track_a_01376,"Bless his heart $ < 3 Warnings: smoking, swearing, ridiculous spacing ( apologies ) I leaned thoughtfully against the brick wall outside of the studio, feeling the cold, rugged material of the stone press against my back through the black military blazer I wore, as I took a drag from my cigarette.",0,0,0,0,0
eng_train_track_a_01378,"The park is a small field, the only way out is at one end with a small fence with a gate, otherwise it's closed off.",0,1,0,0,0
eng_train_track_a_01380,"To top it all off, my back started to sieze up, possibly due to compensation habits and stress worrying about the issue.",0,1,0,1,0
eng_train_track_a_01383,I sit there with my shotgun and wait.,0,1,0,0,0
eng_train_track_a_01384,He had 4 inches and 40 pounds on me and I still won.,0,0,1,0,1
eng_train_track_a_01385,I was kind of scared of them.So my new knife sharpener came home with me last night and I sharpened all the knives I could lay my hands on.,0,1,0,0,0
eng_train_track_a_01390,This morning after a cup of coffee I went upstairs to get dressed to go running with Scout when something caught my eye on the armrest of my rocking chair.,0,0,0,0,1
eng_train_track_a_01391,Unfortunately this one did not end the same way ours ended.,0,0,0,1,1
eng_train_track_a_01393,We hit off immediately and became friends.,0,0,1,0,0
eng_train_track_a_01396,"The spark leaped through his body into mine, and then out my hand to the cart.",0,1,0,0,1
eng_train_track_a_01397,"(Also, excuse my writing, it's late)",0,0,0,0,0
eng_train_track_a_01405,She legged it back to house scared shitless.,0,1,0,0,1
eng_train_track_a_01407,"Something went horribly wrong at the first one and I found my head empty, my thoughts run away.",0,1,0,1,0
eng_train_track_a_01408,"Maybe my nose is often runny, but I can smell danger well enough.",0,1,0,0,0
eng_train_track_a_01410,She was super happy for M.,0,0,1,0,0
eng_train_track_a_01411,It's too late.,0,1,0,1,0
eng_train_track_a_01412,"`` I thought that I was biting into something hard in my taco, but it was my TOOTH!",0,1,0,0,1
eng_train_track_a_01416,I couldn't sleep last night for the adrenaline running through my veins.,0,1,0,0,0
eng_train_track_a_01417,... as it engulfs every fiber of muscle in my legs!!!,0,1,0,0,0
eng_train_track_a_01418,so i just kept nodding my head and smiling.,0,0,1,0,0
eng_train_track_a_01419,"It made me feel weird, like my stomach was tightening and I could feel that stupid blush again on the back of my neck and yet I couldn't look away.I don't know how long I stood there, staring into his eyes like that.",0,1,0,0,1
eng_train_track_a_01421,"After we had finished eating, some of us continued shopping ( or wandering around the shops ) and a number of times, I was told to crouch down with my knees spread or bend over and had the jumper lifted.",0,1,0,0,0
eng_train_track_a_01422,He was just plain GONE into thin air.,0,1,0,1,1
eng_train_track_a_01423,) is going to die tonight.,0,1,0,1,1
eng_train_track_a_01424,Only damage done was scarring and a broken collar bone.,0,1,0,1,0
eng_train_track_a_01425,Then it suddenly stopped.,0,1,0,0,1
eng_train_track_a_01426,wah my face all cringed up.,0,0,0,1,0
eng_train_track_a_01429,Voice will occassionally change like in the movies.,0,0,0,0,1
eng_train_track_a_01433,I immediately realized what had happened and tried to cover it up by gasping.,0,1,0,0,1
eng_train_track_a_01434,I then pushed myself up using my arms.,0,0,0,0,0
eng_train_track_a_01438,My feet started taking a heavy beating and the sun was burning my whole body.,0,1,0,1,0
eng_train_track_a_01439,"One flew up and landed on my knee, another kept trying to draw attention to himself by flying up just inches from my face.",0,1,0,0,1
eng_train_track_a_01441,"my eyes relaxed, and i relaxed for a while.",0,0,1,0,0
eng_train_track_a_01442,"Enthusiastic and filled with hope I entered the voting booth that was so small I had to duck to get in, and hit my head.",0,0,1,0,1
eng_train_track_a_01443,I'm pretty sure I know who you're talking about in this post.,0,0,0,0,1
eng_train_track_a_01444,I was very sad for that snake who only died because I was too stupid to leave it alone!,0,0,0,1,0
eng_train_track_a_01446,They were dancing to Bolero.,0,0,1,0,0
eng_train_track_a_01447,Our classmate Mark had passed away late last night in his sleep.,0,1,0,1,1
eng_train_track_a_01448,He wasn't fucking with me either.,1,0,0,0,0
eng_train_track_a_01449,"One day, we lost all contact.",0,1,0,1,0
eng_train_track_a_01453,The object was shaped funny and broken at an odd fracture.,0,1,0,0,1
eng_train_track_a_01454,"However, there is someone else who's trying to win my heart.",0,1,1,0,0
eng_train_track_a_01455,"The back half is dark and dense woods, overgrown, only one trail winding through.",0,1,0,0,0
eng_train_track_a_01456,As long as it doesn't feel as though my throat and tongue are swelling then there's not much to worry about I guess.,0,1,0,0,0
eng_train_track_a_01457,"probably towed by now"".",0,1,0,0,0
eng_train_track_a_01458,I keep trying to keep my head up and not think about it.,0,1,0,1,0
eng_train_track_a_01459,So what happens is we get there.,0,0,0,0,0
eng_train_track_a_01460,Alarms rang in my head.,0,1,0,0,0
eng_train_track_a_01461,"See, I saw the movie trailer first, and it looked interesting, ( and, yes, I do have a bit of a crush on Pattinson ) and in my head I made up my own story.",0,0,1,0,0
eng_train_track_a_01462,"In that instant, this is what went through my brain.",0,1,0,0,1
eng_train_track_a_01463,"Turns out this big lug was basically 90% heart, 5% muscle, 5% brain.",0,0,1,0,1
eng_train_track_a_01466,"I set off down the street, walking with my head tilted slightly downwards, hiding my face from view.",0,1,0,1,0
eng_train_track_a_01467,Let's hit it.,0,0,1,0,0
eng_train_track_a_01470,"Then, without warning, they disperse.",0,1,0,0,1
eng_train_track_a_01471,""" The black family behind me looked mortified.",0,1,0,1,1
eng_train_track_a_01472,Swerved the car so I would make it.,0,1,0,0,1
eng_train_track_a_01473,Im wasting my time doing nothing with my sister's E5700 hanging on my neck.,0,1,0,0,0
eng_train_track_a_01474,And the turbulence and near-death experiences.I hurt my neck again too.,0,1,0,1,0
eng_train_track_a_01475,"But early in the morning, say five or six, they all fell asleep.",0,0,0,0,0
eng_train_track_a_01479,"In my grandmother's home, she blocked off the formal living-room and dining-room with ""baby gates"" to keep me and my siblings and cousins from getting in and breaking stuff like her good china and antique furniture.",0,0,0,0,0
eng_train_track_a_01482,"It was several years later that I realized that I had probably narrowly avoided being molested, kidnapped, or worse.",0,1,0,1,1
eng_train_track_a_01484,Mom asked us all to sit down and that's when my heart began to sink.,0,1,0,1,0
eng_train_track_a_01485,"I think I could've laughed my head off that night, except that I had to keep my head in place so I could laugh some more, haha.",0,0,1,0,0
eng_train_track_a_01488,My feet were totally soaked through.,0,1,0,1,0
eng_train_track_a_01489,"All the while, my foot throbbing.",0,1,0,0,0
eng_train_track_a_01490,I couldn't get my feet undone so I just... fell over.,0,1,0,0,0
eng_train_track_a_01491,I ate a delicious sandwich on an everything bagel and one of the seeds got stuck in between my teeth.,0,1,0,0,0
eng_train_track_a_01494,"I nodded, pulling my arms across my chest, hoping that the rain obscured the tears that ran from my eyes.",0,1,0,1,0
eng_train_track_a_01500,"Moved into a new office, and being an internet company, it was important The internet worked..",0,1,1,0,0
eng_train_track_a_01503,And my heart bleeds.,0,1,0,1,0
eng_train_track_a_01508,"You slid through me like a hot knife through butter under my skin, and never gone yet.",0,1,0,1,1
eng_train_track_a_01509,"The owners have a light in their yard for security purposes, but the light doesn't extend really far.",0,0,0,0,1
eng_train_track_a_01513,I naively walked up and stuck my head in the driver's window hole.,0,1,0,0,1
eng_train_track_a_01516,my legs were sore from yesterdays squats.,0,0,0,1,0
eng_train_track_a_01517,I stomped my foot in anger.,1,0,0,0,0
eng_train_track_a_01518,"I had my hand on the side of my face when I was drawing, and then I moved it and was like ` OH MY GOD I 'M BLEEDING OUT MY EARS AHHHHH!",0,1,0,0,1
eng_train_track_a_01519,Scouts disguised as farts.,0,0,1,0,1
eng_train_track_a_01521,"I have obnoxious bug bite on my finger, ugh probably from going on that trail.",0,1,0,0,0
eng_train_track_a_01523,We had hiked for about an hour through the shallow water and were looking for cool rocks and other things in the river.,0,0,1,0,0
eng_train_track_a_01526,Some work had been done on the driveway.,0,0,0,0,0
eng_train_track_a_01528,I got to babysit my grandson but my back hurt the next day.,0,0,1,1,0
eng_train_track_a_01529,"I woke up one night, and my heart was racing I shake away the drowsiness and started tracing for what i had dreamt about moments before.",0,1,0,0,0
eng_train_track_a_01531,Slow down so I don't stub my toe when I'm running down the driveway to pick up my mail.,0,1,0,0,0
eng_train_track_a_01532,"Have i just made my first ""ghost poo""?",0,1,1,0,1
eng_train_track_a_01533,We walked every aisle and I had so many ideas pop into my head.,0,0,1,0,0
eng_train_track_a_01534,"In the single worst moment of 21.5 years, six martinis errupted from my mouth.",0,1,0,1,0
eng_train_track_a_01537,Four hours had passed.,0,0,0,0,0
eng_train_track_a_01540,my heart's finally starting to feel at peace and everything that used to feel wrong is suddenly starting to feel really right.,0,0,1,0,0
eng_train_track_a_01544,"Despite that the city is called `` Sin City '', the city of Las Vegas catches my eye; the fact that my favorite movie is set in the city could be a main reason why.",0,0,1,0,0
eng_train_track_a_01547,"I stood up, still violently too high, and walked over to my friend, who was still on the ground.",0,1,0,1,0
eng_train_track_a_01548,"so he went a lil faster ( keep in mind we never went really fast ) and i lost the tray, hit my knee on the ground, and tried to hang on until he stopped!",0,1,0,1,1
eng_train_track_a_01550,Walking through the toilet aisle I decide to let a fart out and make the aisle smell.,0,0,1,0,1
eng_train_track_a_01552,Grant you I still don't have total use of my shoulder and I have to use my left arm for certain things but it was wonderful to drive again.,0,0,1,0,0
eng_train_track_a_01559,"A close friend set me up on a double date with her, her boyfriend, and the boyfriend's friend on Valentine's Day.",0,1,1,0,1
eng_train_track_a_01561,"I had been flung on top of the bike, and the handle bar was on my stomach.",0,1,0,1,0
eng_train_track_a_01562,"I found that when I changed my thoughts, it changed my heart.",0,0,1,0,0
eng_train_track_a_01563,"I saw some of the girls staring but they didn't say anything, well not to my face.",0,0,0,0,0
eng_train_track_a_01564,"I wore cologne, to get the feeling right.",0,0,1,0,0
eng_train_track_a_01566,I always wanted to see one.,0,0,1,0,1
eng_train_track_a_01567,"He breathed on my face, nuzzled my hair with his nose and licked the top of my head.",0,0,1,0,0
eng_train_track_a_01568,Apparently my leg had fallen asleep and I didn't know it.,0,1,0,0,0
eng_train_track_a_01572,I was on a (admittedly silly) adrenaline rush.,0,1,1,0,1
eng_train_track_a_01574,"Probably going to get buried, spooky as hell, and very real.",0,1,0,0,1
eng_train_track_a_01576,I got on the pole and went down till I could reach the seint with my foot and I pulled it under me and I got in.,0,1,0,0,0
eng_train_track_a_01577,"He picked her up and put her in front of a mirror and said : ""Look, look at you!",0,0,1,0,1
eng_train_track_a_01578,"That night, around 2am, she woke up to the sound of a woman screaming.",0,1,0,1,1
eng_train_track_a_01579,"I adjusted to the noise inside my head, and in turn, my inner need to analyze and obsess died out.",0,1,1,0,0
eng_train_track_a_01580,He could not explain.,0,1,0,1,1
eng_train_track_a_01582,"I stopped moving, bent down with my palm out, and let the squirrel jump up on my arm and onto my shoulder.",0,0,1,0,0
eng_train_track_a_01584,I blinked a few times and fought with myself to deny what I was seeing.,0,1,0,1,1
eng_train_track_a_01586,"When I first saw Tangled on Thanksgiving, it ate my brain.",0,0,1,0,1
eng_train_track_a_01587,"I sit up, my head hurts.",0,1,0,1,0
eng_train_track_a_01588,"I made sure to run my hand along the length of that wall knowing that Brad Pitt, George Clooney & Matt Damon had stood there, sad but true!",0,0,1,1,0
eng_train_track_a_01589,"I had no other option, not with the way my heart started beating erratically at the mention of his name.",0,1,0,0,1
eng_train_track_a_01590,"The headwind down this piece of road was not good, I had my head down, not good for talking in as much oxygen as I could.",0,1,0,0,0
eng_train_track_a_01591,"So he should be eating the pizza I'm stuffing into my face, like a chipmunk.I understand the impulse these days.",0,0,1,0,0
eng_train_track_a_01593,My ankles and front of shins felt stiff.,0,1,0,0,0
eng_train_track_a_01601,"Same girl, same exact process.",0,0,0,0,0
eng_train_track_a_01603,"I thought that was a pretty good idea ( by this point, my feet hurt a LOT from all the walking and standing around ) but I didn't want to pay to see a movie.",0,1,0,0,0
eng_train_track_a_01604,Or at least that's what the neurons in my brain say.,0,1,0,0,0
eng_train_track_a_01606,"I feel bad for my employees too-they're all sad and call me almost everyday, and it really breaks my heart.",0,1,0,1,0
eng_train_track_a_01607,"Early the next morning, newspaper under my arm, I approached the counter of the coffee shop and asked for two medium coffees, black, three-quarters full only.",0,0,0,0,0
eng_train_track_a_01608,"= Okay blablabla ~ And then, the dentist check up my teeth.",0,0,0,0,0
eng_train_track_a_01610,All this water gets poured directly in my face but I noticed it didn't hit my eyes and thats when I realized I Was wearing sunglasses inside!,0,0,1,0,1
eng_train_track_a_01611,I loved watching the planes fly over us and then this one plane was somehow flying in reverse direction.,0,0,1,0,1
eng_train_track_a_01614,It was horribly intriguing.,0,1,1,0,1
eng_train_track_a_01616,That night I sat at my computer and read about Rainbow Bridge and cried some more and I could actually feel my heart hurt with the pain of loss.,0,1,0,1,0
eng_train_track_a_01618,"Jenny, I, my throat choked when I hear my daughter's voice.",0,1,0,1,0
eng_train_track_a_01620,"they played the majority of the classics thank god, and i screamed my heart out which is why i have no voice right now.",0,0,1,0,0
eng_train_track_a_01623,My heart arrested twice; I was shocked four times.,0,1,0,0,1
eng_train_track_a_01624,for the wedding AND rehearsal dinner.,0,0,0,0,0
eng_train_track_a_01626,This was on both sides of my chest.,0,1,0,0,0
eng_train_track_a_01627,One X-ray showed my foot from above and the other showed it from the side.,0,0,0,0,0
eng_train_track_a_01629,"Because I haven't trained for this run at all, my legs gave up on me around 10 miles in.",0,1,0,1,0
eng_train_track_a_01630,"I always try to remember these incidents whenever someone claims to have experienced something strange, and realize that my stories would sound just as loopy to them.",0,0,0,0,0
eng_train_track_a_01631,"I see the match, held tightly in my hand.",0,0,0,0,0
eng_train_track_a_01637,Entire room goes silent.,0,1,0,0,1
eng_train_track_a_01640,Not to mention the top portion doesn't fit my belly so therefor i have the top button undone.,0,0,0,0,0
eng_train_track_a_01642,Happy birthday to you and me!,0,0,1,0,0
eng_train_track_a_01643,My great-grandparents had an arranged marriage.,0,0,0,0,1
eng_train_track_a_01645,"My left clav essentially blew up, but it didn't stop there.",0,1,0,0,1
eng_train_track_a_01646,"I say, covering my ears with my hands and cringing into the door.",0,1,0,1,0
eng_train_track_a_01647,"xD As of now, I'm getting tired all the time and my belly is getting firm already.",0,1,1,1,0
eng_train_track_a_01648,He was pretty scared and was talking fast.,0,1,0,0,0
eng_train_track_a_01650,"He said yes, I closed my eyes, and seeking from divine, I sang precisely two lines, describing, my wishes for him.",0,0,1,0,0
eng_train_track_a_01652,It disconnected and teetered away from us.,0,1,0,1,1
eng_train_track_a_01657,Well literally no one showed up.,0,0,0,1,1
eng_train_track_a_01658,"No water damage, sun damage, tears, anything.",0,0,0,0,1
eng_train_track_a_01659,We roll up to the drive thru and proceed to order nearly the entire dollar menu.,0,0,1,0,0
eng_train_track_a_01660,I bent my knee inward.,0,0,0,0,0
eng_train_track_a_01663,Wrapping his arms tightly around me and letting a warm breath escape his mouth onto the back of my neck.,0,0,1,0,0
eng_train_track_a_01666,I quickly fell asleep.,0,0,1,0,0
eng_train_track_a_01668,The second entry of today: / my brain hurt for answering 30 math question in one day.,0,1,0,0,0
eng_train_track_a_01669,My eyes had been closed and as I had opened them everything seemed to metirialize infront of me like a liquid curtain dropping infront of me.,0,1,1,0,1
eng_train_track_a_01670,"During the complete silence that follows, my grandfather says loudly ""Well, my god has spoken""",0,0,0,0,1
eng_train_track_a_01672,I have no idea what manki is so I have no idea where to look.,0,1,0,0,1
eng_train_track_a_01673,the ledge of the beadboard dug into my back.,0,1,0,1,0
eng_train_track_a_01679,"When i was very ill, in great suffering-such pain that even my skin hurt-i gave up.",0,1,0,1,0
eng_train_track_a_01680,Poor Shannon's gon na be stuck with our leftovers for the rest of summer!I also freaked the girls out with my ankle ( it's in a stretchy brace and turning a very interesting shade of purple ).,0,1,0,1,0
eng_train_track_a_01684,We had absolutely nothing in common.,0,0,0,1,0
eng_train_track_a_01685,Apparently it wasn't as life threatening as I believed at the time because the doctor didn't want to mar my forehead with stitches so I got butterfly bandages instead.,0,1,0,1,0
eng_train_track_a_01686,"Creepy place, never been a fan.",0,1,0,0,0
eng_train_track_a_01689,Dated a woman who invited me to her birthday party.,0,0,1,0,0
eng_train_track_a_01691,On this monday I went in to get my radiation treatment and couldnt stop crying from the pain in my leg.,0,1,0,1,0
eng_train_track_a_01692,( Is it inappropriate that I can't get Steve Wonder's `` Writings on the Walls '' out of my head now...? ),0,1,1,0,0
eng_train_track_a_01693,As time passed it became quite the fancy outlet for my extreme ( sometimes intolerable ) idiosyncracies and papyrus on which to record both my daily happenings and ( most importantly ) some of my innermost thoughts that I wanted to tell the select few that i hold dear and close to my heart.,0,0,1,0,0
eng_train_track_a_01695,And I dongak my head to see who was in front of me.,0,0,0,0,0
eng_train_track_a_01697,Anyway it was weird.,0,1,0,0,1
eng_train_track_a_01700,My mum says that when she looked in the mirror she saw a pair of glowing yellow eyes.,0,1,0,0,1
eng_train_track_a_01704,"I took my shirt off and washed my face, hands and arms then I took a paper towel and slowly washed my belly.",0,0,0,0,0
eng_train_track_a_01706,Not worth the risk.,0,1,0,1,0
eng_train_track_a_01707,"I see two small ""children"", floating about 4 ft. away from me.",0,1,0,0,1
eng_train_track_a_01708,He lives behind a church and part of his backyard boarders the parking lot in back of the church.,0,0,0,0,0
eng_train_track_a_01709,"I never said anything because it wasn't scary, just weird.",0,1,0,0,1
eng_train_track_a_01711,"While packing up our booth at CHA, I momentarily threw my back out.",0,1,0,0,0
eng_train_track_a_01713,So I grabbed my knife out of fear and looked up but there was nothing there.,0,1,0,0,1
eng_train_track_a_01714,"As the ocean roiled and seethed sturdy arms lifted my head, bidding me to simply breathe $ `` Breathe! ''",0,1,0,0,0
eng_train_track_a_01717,"None the less, she was breathtaking.",0,0,1,0,1
eng_train_track_a_01719,This is my story.,0,0,0,0,0
eng_train_track_a_01720,"- Once this item leaves my hands, I am not responsible for the package.",0,0,0,0,0
