id,text,anger,fear,joy,sadness,surprise
eng_train_track_a_02007,I followed the direction it went thinking it was my friend.,0,1,0,0,1
eng_train_track_a_02011,I saw down the hallway a figure walking slowly toward me.,0,1,0,0,1
eng_train_track_a_02030,All of a sudden we were standing on the street corner waiting for the light to change so we could cross.,0,0,0,0,1
eng_train_track_a_02033,"My hands, my lips, my touch These and are few to what it takes To build something no one can imagine.",0,0,1,0,0
eng_train_track_a_02035,"Browsing through that page about wheels, this castle wheel, by H. H. Napier / Glenfield Industries, caught my eye.",0,0,1,0,0
eng_train_track_a_02085,Hence the goofy grin on my face.,0,0,1,0,0
eng_train_track_a_02102,"We didn't swing, we just rested and enjoyed the weather.",0,0,1,0,0
eng_train_track_a_02103,"I shrugged, my eyes on the TV.",0,0,0,0,0
eng_train_track_a_02110,""" and burst out laughing.",0,0,1,0,1
eng_train_track_a_02114,and I nodded my head.,0,0,0,0,0
eng_train_track_a_02121,so I'm stir my heart for Europe travel.,0,0,1,0,0
eng_train_track_a_02127,"I spent the night in my room, then went to bed.",0,0,0,0,0
eng_train_track_a_02128,I sleep facing away from my door.,0,1,0,0,0
eng_train_track_a_02132,"I tilted my head to the side and smiled, `` I know you are.",0,0,1,0,0
eng_train_track_a_02151,Every boarding school has some odd tradition or skill students must undertake before graduation.,0,0,0,0,1
eng_train_track_a_02152,As I walked through the waiting area I could not believe my eyes at what I saw.,0,0,0,0,1
eng_train_track_a_02162,I was at a large rock festival.,0,0,1,0,0
eng_train_track_a_02201,He then reached across with one of his front paws and put it around my arm.,0,0,0,0,0
eng_train_track_a_02208,I though nothing of it until I turned out the lights.,0,1,0,0,1
eng_train_track_a_02214,It was super cool and the girl who I offered it to was super sweet (and actually sent me some tea and a lipstick in return).,0,0,1,0,1
eng_train_track_a_02218,"I like how sometimes, my skin makes is so easy for me to be invisible.",0,0,1,0,0
eng_train_track_a_02228,I slid my hand into my pocket and took out my knife.,0,1,0,0,0
eng_train_track_a_02229,I see the cycles.,0,0,0,0,1
eng_train_track_a_02250,"The next day I turned it back on and all was fine, and when I checked the sample music and my own, there was nothing that sounded even remotely similar.",0,0,1,0,1
eng_train_track_a_02265,In keeping it simple and short.,0,0,0,0,0
eng_train_track_a_02269,my bedroom was next to the kitchen.,0,0,0,0,0
eng_train_track_a_02274,"throwing my legs out 45 degrees, i smiled and said `` wheeeeee ''.",0,0,1,0,0
eng_train_track_a_02276,"So I sit across from this guy and this girl, I say hi to the girl and I turn to the guy and we just stare at each other for at least 30 seconds to a minute.",0,1,0,0,1
eng_train_track_a_02291,"I don't know how, but as soon as we started, I got 3 numbers in a row completely correct.",0,0,1,0,1
eng_train_track_a_02301,"""Yeah, but did you just find that?",0,1,0,0,1
eng_train_track_a_02303,I turned my head to oncoming headlights.,0,1,0,0,0
eng_train_track_a_02319,This drew a lot of startled stares and gasps as I calmly threw the shirt down on the floor at my feet and reached into the overnight bag and pulled out a small pair of tweezers.,0,0,0,0,1
eng_train_track_a_02330,I just had my super shiok shower at my awesome home and then i use my towel to wipe my face.,0,0,1,0,0
eng_train_track_a_02359,"One morning though, he slept in.",0,0,0,0,1
eng_train_track_a_02373,I have seen the sr71 at smithsonian this thing was bigger.,0,0,1,0,1
eng_train_track_a_02382,"Anyway, there was this one girl (about 8 or 9 years old) who would always sit quietly and smile.",0,0,1,0,0
eng_train_track_a_02393,I noticed his eyes looked weird...scary.,0,1,0,0,1
eng_train_track_a_02400,"They jumped from the couch and aimed for all of the areas with sensitive skin-the underside of my arm, along my belt line, the insides of my thighs.",0,1,0,0,0
eng_train_track_a_02410,Her mother is bouncing up and down with excitement.,0,0,1,0,0
eng_train_track_a_02414,"I froze for a few seconds, then slowly extended my fingers around both sides of its tiny body.",0,1,0,0,0
eng_train_track_a_02428,""" Those little blonde kids!",0,0,0,0,1
eng_train_track_a_02442,"One is explainable, the other still stumps me.",0,1,0,0,1
eng_train_track_a_02447,"That evening, they put me down to sleep in the cot, and went about their evening routine.",0,0,0,0,0
eng_train_track_a_02454,Things are relatively quiet.,0,0,1,0,0
eng_train_track_a_02462,"As soon as I started climbing, my hands felt toasty warm.",0,0,1,0,0
eng_train_track_a_02472,It looked so unreal.,0,1,0,0,1
eng_train_track_a_02509,One memorable example was the doubling space pen.,0,0,1,0,1
eng_train_track_a_02512,I see that my 13 year old son's bedroom is ajar.,0,1,0,0,1
eng_train_track_a_02518,"In the late afternoon I am lying in the sun, my music plugged firmly into my ears, dancing.",0,0,1,0,0
eng_train_track_a_02520,At 3000 comments deep no one will read it but I genuinely believe it's the creepiest one here.,0,1,0,0,1
eng_train_track_a_02523,He said it was rather delicious and tried to spoon feed me.,0,0,1,0,0
eng_train_track_a_02531,You get the picture.,0,0,0,0,0
eng_train_track_a_02538,This is how we found out why all freshman year we were both greeted by people we didn't know calling us the wrong name.,0,0,0,0,1
eng_train_track_a_02540,Everyone is distinctly average their first time.,0,0,1,0,0
eng_train_track_a_02546,P. if you're reading this...FUCK YOU.,1,0,0,0,0
eng_train_track_a_02554,I ate a pizza.,0,0,1,0,0
eng_train_track_a_02556,"*  In trying to include new mother in law into the wedding festivities, I invited her to pick out the flower girl dress for her granddaughter (her other son's daughter).",0,0,1,0,0
eng_train_track_a_02558,"You name it, I did it.",0,0,1,0,0
eng_train_track_a_02561,"Open the bedroom door, Brandon fast asleep on the bed.",0,0,1,0,0
eng_train_track_a_02572,"Everything, and I mean everything, matched up.",0,0,1,0,0
eng_train_track_a_02584,I said thank you and thought nothing of it.,0,0,1,0,0
eng_train_track_a_02595,and then my cheeks get even redder.,0,0,0,0,0
eng_train_track_a_02606,We stare at the monitor and see him head right to the kitchen utensils section.,0,0,0,0,1
eng_train_track_a_02612,So I got up and tried him again.,0,1,0,0,0
eng_train_track_a_02619,"Face down in an unfamiliar bed, he turned blinking in unexpected sunlight.",0,1,0,0,1
eng_train_track_a_02635,"i'm like amused by the auntie who's holding my arm all the way, and i'm thinking of all the weird pictures i took with yongqing, then i remembered my flying eyebrows, and my smile = & %!",0,0,1,0,0
eng_train_track_a_02640,You might actually say they're almost angelic....,0,0,1,0,1
eng_train_track_a_02642,Seventh grade Spanish test.,0,1,0,0,0
eng_train_track_a_02660,I am groggy with 1 eye half closed.,0,1,0,0,0
eng_train_track_a_02663,"I opened it up and there was a different tape in it titled ""new year""",0,0,0,0,1
eng_train_track_a_02665,"I sat there and closed my eyes as the water ( oyu for hot water, people, not mizu ) swirled around me like a mini massage.",0,0,1,0,0
eng_train_track_a_02678,I swear my heart halted for a split second before sprinting.,0,1,0,0,1
eng_train_track_a_02686,"My brother was tapping me on my shoulder, and I was like `` What? ''",0,0,0,0,0
eng_train_track_a_02692,"""I LOVE YOU, I LOVE YOU, I LOVE YOU...""",0,0,1,0,0
eng_train_track_a_02694,same thing similar with my job.,0,0,0,0,0
eng_train_track_a_02710,See my thumbs.,0,0,0,0,0
eng_train_track_a_02711,"Such a soft mouth, such sweet breath tickeling the fuzz on my skin.",0,0,1,0,0
eng_train_track_a_02722,I immediately stretched my arm to grab my phone.,0,0,0,0,0
eng_train_track_a_02724,I've got it all planned up in my head,0,0,1,0,0
eng_train_track_a_02733,"Thats right,  this iPhone had been lying on train tracks, in broad daylight, for 6 months, and it still worked flawlessly.",0,0,1,0,1
eng_train_track_a_02737,It looks like dark smelly applesauce.,0,1,0,0,1
eng_train_track_a_02748,"Occasionally they will sit out there and smoke cigarettes, which is fine..",0,0,0,0,0
