id,text,anger,fear,joy,sadness,surprise
eng_train_track_a_00847,"This was my rest week and my legs, and everything else were closed for the day.",0,0,1,0,0
eng_train_track_a_00848,"`` Yes, '' I said, the old mask of indifference placed on my face.",0,0,0,0,0
eng_train_track_a_00852,He senses my fear he feels some power he brings up his had I cry and I cower He's out of control I let out a screech he strikes again like lightening tears stream down my cheek there's a flash in his eyes what I beg him to quit bruised swollen cheeks a fracture in my hip.,1,1,0,1,0
eng_train_track_a_00853,My finger is an asshole.,1,0,0,0,0
eng_train_track_a_00855,Levi and I arrived in an eye-capturing city that really blew me off my feet.,0,0,1,0,1
eng_train_track_a_00856,"Of course, in the end I had a better essay to hand in ( can't remember how this impacted the grade ) but I didn't feel like the work I was turning in was mine.So when I'm editing Jenn's work a shiver runs down my spine that my father is also standing above my shoulder editing my edits.",0,1,0,0,0
eng_train_track_a_00861,"But, to his dismay, the toilet won't flush.",1,1,0,0,1
eng_train_track_a_00865,"i just cracked my head into a glass door.A delivery person, instead of calling me and saying `` I've got a package. ''",1,1,0,0,0
eng_train_track_a_00866,I remember bringing it to my kindergarten class once to watch on a movie day.,0,0,1,0,0
eng_train_track_a_00872,This was right before sunset when we got in bed and I instantly fell asleep.,0,0,1,0,0
eng_train_track_a_00875,"And here in Edinburgh, through this journey of mine, it has been right at my side, in my hand.",0,0,1,0,0
eng_train_track_a_00880,"I spent all day at home, sick.",0,1,0,1,0
eng_train_track_a_00881,still cant get my head around the fact that this time 2 weeks ill be home.,0,1,0,0,0
eng_train_track_a_00884,I had to relax my muscles and clear my mind in order to do that.,0,1,0,0,0
eng_train_track_a_00885,"Prior to, we got some humongous popsicles which turned my tongue an amazing shade of blue, and we visited the children's A&S display.",0,0,1,0,0
eng_train_track_a_00886,"`` I zip up the tote back quickly, throw it onto my shoulder and grab up the other, larger bag.",0,0,1,0,0
eng_train_track_a_00888,He had a large going away party.,0,0,1,0,0
eng_train_track_a_00889,"`` Yeah, im good now, my back has stopped bleeding $.",0,1,0,0,0
eng_train_track_a_00891,Eight inches here Nine inches there My feet in the snow.,0,1,0,0,0
eng_train_track_a_00893,Thoughts of the movie Phantasm were swirling through my head.,0,1,0,0,0
eng_train_track_a_00894,After reading the top comment about the person's mom and her friend... maybe she isn't telling me something.,0,1,0,0,1
eng_train_track_a_00895,"Standing at the edge of my heart, I'm gazing, I'm listening Like seeing an ocean in a cold winter night Such a fear, I'm falling, breaking into pieces.",0,1,0,1,0
eng_train_track_a_00896,I liked spending all my nights at home hula hooping and listening to pop music and laughing at jokes inside my head.,0,0,1,0,0
eng_train_track_a_00897,"I stumbled out of bed, probably 4 in a morning in a most-asleep daze and went to the bathroom.",0,1,0,0,0
eng_train_track_a_00900,"It was a sad, strange experience.",0,1,0,1,1
eng_train_track_a_00904,My blood turned to icewater in my veins.,0,1,0,0,0
eng_train_track_a_00905,My arms start getting numb and achy and no way to lie makes them stop.,0,1,0,1,0
eng_train_track_a_00908,And they probably knew exactly what your dad saw.,0,1,0,0,1
eng_train_track_a_00911,"But I get beyond that tired stage, and can't close my eyes later.",0,1,0,1,0
eng_train_track_a_00914,Lots of profanity and screaming.,1,1,0,0,0
eng_train_track_a_00917,", my stomach turned into a pile of dogshit and I nearly puked.",0,1,0,0,0
eng_train_track_a_00918,At times I was actually having difficulty breathing because the water was in my nose.,0,1,0,0,0
eng_train_track_a_00919,"It worked, I was scared shitless for the rest of the visit.",0,1,0,0,0
eng_train_track_a_00920,So my leg is shaking at a million miles an hour and I turn into the target parking lot as she sort of continues to follow me.,0,1,0,0,0
eng_train_track_a_00921,A highly intoxicated roommate and a black girl going at it.,1,1,0,0,1
eng_train_track_a_00922,"blah I want my head to stop hurting, and my eyes to start tearing up but I do nt see any of these things happening soon.",0,1,0,1,0
eng_train_track_a_00924,My hands were very cold.,0,1,0,0,0
eng_train_track_a_00925,and then i accidently dropped the tag because my hand was shaking so much.,0,1,0,0,0
eng_train_track_a_00928,Prior to the opening of the hunting season in the autumn (when the whole hunting collective/club goes to hunt together) we go hunting alone.,0,1,0,0,0
eng_train_track_a_00930,"So I went ahead and finished it, but it fits my head without quite covering my ears, so even though I started out knitting it for you, it didn't end up working.",0,0,0,0,0
eng_train_track_a_00933,"It never freaked me out, because it happened enough as i was small and I got used to it.",0,1,0,0,0
eng_train_track_a_00934,I've never had my cheeks hurt so much from laughing and / or smiling.,0,0,1,0,0
eng_train_track_a_00937,"She hit Katahdin, and celebrated.",1,0,1,0,0
eng_train_track_a_00939,He also told me I would be his wife one day.,0,0,1,0,1
eng_train_track_a_00940,We shared about a minute of spaz-dancing and off-key singing before we went our seperate ways.,0,0,1,0,0
eng_train_track_a_00941,I go to her pictures and see the image of what was in my head right there in front of me...,0,0,1,0,1
eng_train_track_a_00943,I struggle to make out the images my eyes begin to pick up.,0,1,0,0,0
eng_train_track_a_00946,I closed my eyes and felt the elements around me.,0,0,1,0,0
eng_train_track_a_00949,I felt like Batman that day.,0,0,1,0,0
eng_train_track_a_00950,i closed my eyes and heard something hit the ground.,0,1,0,0,1
eng_train_track_a_00953,"Arms back, chin down.",0,1,0,0,0
eng_train_track_a_00954,"I was sitting in the van trying to stay warm, and going over the following day's logistics in my head.",0,1,0,0,0
eng_train_track_a_00960,Then a few days later i told her Jenny wanted me to come to the basement to play with her.,0,1,0,0,1
eng_train_track_a_00963,"Amanda and I carried the washer up with no problems but as we sat it down in the street, my back gave out.",0,1,0,1,0
eng_train_track_a_00966,"A strangely calming breeze crosses my face and shoulders, mysteriously skipping right over my legs.",0,0,1,0,0
eng_train_track_a_00967,I'll never forget the bitch-death-glare she shot me.,1,1,0,0,0
eng_train_track_a_00968,He was admiring the tattoo on my forearm.,0,0,0,0,0
eng_train_track_a_00969,We did this like 3 times before we just decided to leave it in the closet.,0,0,0,0,0
eng_train_track_a_00970,Today I must do the dreaded studying: ( Blarg.I did a bit last night ( some review ) and it is amazing how quickly this shit leaves my brain after taking 1.5 days off from it.,1,1,0,1,0
eng_train_track_a_00971,""" I figure she probably spent all night hiding in a corner.",0,1,0,1,0
eng_train_track_a_00973,I love telling this story.,0,0,1,0,0
eng_train_track_a_00974,"determined well, i've been going to the gym a little over three weeks now, and i've lost eight pounds, and roughly twelve inches total-about three from my waist, two and a half from my hips, a half inch from each thigh, and four total from my... um... upper torso area... anyway, it feels awesome.",0,0,1,0,0
eng_train_track_a_00977,"Not too scary, right?",0,1,1,0,1
eng_train_track_a_00979,Pain-I have injured my knee somehow.,0,1,0,1,0
eng_train_track_a_00981,"Not the most unnerving feeling, but the most prominent event in my mind is as follows:",0,1,0,0,1
eng_train_track_a_00985,skudai * < 3 > i can closed my heart and my mind.,0,0,0,0,0
eng_train_track_a_00988,Needless to say I was kind of scared.,0,1,0,0,0
eng_train_track_a_00989,When she woke up the next morning she decided to figure out what the hell had happened.,0,1,0,0,1
eng_train_track_a_00991,"During my first season, I was playing a game on my birthday.",0,0,1,0,0
eng_train_track_a_00992,My parents were confused.,0,1,0,1,1
eng_train_track_a_00993,A song started to loop inside my head.,0,1,1,0,0
eng_train_track_a_00997,"I even tried to sleep sitting up for a bit, that ended when I nearly gave myself whiplash when my head dropped.",0,1,0,0,0
eng_train_track_a_00998,"My room is structured so there are two doors, one to the bathroom, which feeds through to another door in the hallway, and the main door to my room from the same hallway.",0,0,0,0,0
eng_train_track_a_01000,Almost at the instant that the first drop of sweat popped out on my head I had the weirdest experience.,0,1,0,0,1
eng_train_track_a_01002,"After we were done, I could barely even move my fingers and I think I am going to be sick in a few days.",0,1,0,1,0
eng_train_track_a_01003,Dove brought me a nice glass of ice water and the bottle of the pain pills and an ice pack for my hand.,0,1,0,0,0
eng_train_track_a_01004,"Originally Posted September 18th, 2007 I walked down the driveway, pushing back the stinging pain that kept trying to force a few tears out of my eyes.",0,1,0,1,0
eng_train_track_a_01006,In retrospect this implied extreme circumstances.,0,1,0,0,1
eng_train_track_a_01007,It was hairless and covered in gray skin.,0,1,0,0,1
eng_train_track_a_01010,Some children came out and cheered me on offering water and slapping my back.,0,0,1,0,0
eng_train_track_a_01014,She sat at her Papa's recliner sofa only to move next to me and start clinging to my arms.,0,0,0,0,0
eng_train_track_a_01016,Never saw them again...,0,0,0,1,0
eng_train_track_a_01017,I farted and a little nugget fell out onto the floor.,0,0,1,0,1
eng_train_track_a_01020,"I managed to shoehorn myself into the seat but my knees were jammed under the dash, I could barely use the pedals, I couldn't get any proper lock on the steering wheel, my head was poking out of the rollcage and I had no idea of what the rev limits or gears were.",0,1,0,0,0
eng_train_track_a_01021,So it goes on like this for awhile.,0,0,0,0,0
eng_train_track_a_01023,"As stiff as a board, I didn't move an inch except to dart my eyes to my sleeping sister in the bed ten feet away.",0,1,0,0,0
eng_train_track_a_01025,And made worse by her crying because of the embarrassment.,0,1,0,1,0
eng_train_track_a_01026,"My whole body was painful today, especially my arms.",0,1,0,1,0
eng_train_track_a_01028,Then my hand that had the red figure opened of it's own accord and shot out a red ball of light.,0,0,0,0,1
eng_train_track_a_01031,6 hour old post?,0,0,0,0,1
eng_train_track_a_01032,"But, my stomach... oh... my stomach... This bike has been from Taiwan to Vietnam, Cambodia, and Thailand... and several places in Vietnam, not to mention all but the southern tip of Taiwan... Heading north.",0,1,0,0,0
eng_train_track_a_01033,"I swing my foot back, then proceed to apply a good, strong kick to the underside of the table.",1,0,0,0,0
eng_train_track_a_01034,I found an old sweatshirt on the floor and tied it tightly around my leg.,0,1,0,0,0
eng_train_track_a_01037,"I have major slip ups, like, letting the wrong person close to my heart and getting burned.",0,1,0,1,0
eng_train_track_a_01039,I had never been so scared.,0,1,0,0,0
eng_train_track_a_01040,I pushed those thoughts out of my head and told myself I was being paranoid.,0,1,0,0,0
eng_train_track_a_01041,House almost burned down the weekend they were out of town.,0,1,0,1,1
eng_train_track_a_01042,The stranger crosses the finish line first; the crowd goes wild!,0,0,1,0,1
eng_train_track_a_01047,"Earth Base Delta stopped responding to our calls, and we were left alone in the vast emptiness of space.",0,1,0,1,1
eng_train_track_a_01048,"My teeth were marred by braces, and I hated the sight of them.",0,0,0,1,0
eng_train_track_a_01050,I need to ice my calf often and try to stay off it... except to occasionally stretch it.,0,1,0,0,0
eng_train_track_a_01052,"14 years later, we're still best friends.",0,0,1,0,0
eng_train_track_a_01056,"We get to the porch and my dog starts *growling*, like a big boy growl, like shits going down growl.",0,1,0,0,1
eng_train_track_a_01057,I fought back the tears coming to my eyes.,0,1,0,1,0
eng_train_track_a_01059,"My mouth started buzzing, then fingers, arms and legs.",0,1,0,0,0
eng_train_track_a_01060,Mildly inconvenient but so weird.,0,1,1,0,1
eng_train_track_a_01061,I know with all my heart that taking this job was the right thing to do.,0,0,1,0,0
eng_train_track_a_01063,"`` Then a doctor walked around the corner, and my mouth fell open.",0,0,0,0,1
eng_train_track_a_01064,"the new apples of my eye, as promised.",0,0,1,0,0
eng_train_track_a_01065,Not exactly an objection but very close.,1,1,0,0,1
eng_train_track_a_01067,"Either way, he had threaten to burn my new place down, and miraculously it did.",1,1,0,1,1
eng_train_track_a_01068,"It's also on the front of my upper legs, the back of my lower legs, and the tops of my feet.",0,0,0,0,0
eng_train_track_a_01071,* fuzzy stuff here * Someone was plucking my eyebrows in one of the dressing rooms and I was so upset because they were too thin.,1,0,0,1,0
eng_train_track_a_01072,The Dyatlov Pass Incident.,0,1,0,0,1
eng_train_track_a_01074,Still freaks me out to remember it.,0,1,0,0,1
eng_train_track_a_01076,My fingers are toes are still tingly.,0,1,0,0,0
eng_train_track_a_01077,My jaw hit the floor and i ran out and bought 4 tickets for the closest show in Philidelphia PA. ( the only non-NY / CA show ) Me and 3 friends pile into a car and leave at 9 am the day of the show for a projected 8 hour drive.,0,0,1,0,1
eng_train_track_a_01082,That is all in my head I know.,0,1,0,0,0
eng_train_track_a_01084,Someone is in danger.,0,1,0,1,1
eng_train_track_a_01085,"My chest was lighter, my entire body was lighter.",0,0,1,0,0
eng_train_track_a_01086,"I felt for it, but ended up having to open my eyes to actually find it.",0,1,0,0,1
eng_train_track_a_01087,I know why I got one I have constant allergy symptoms and my head was wet with constant snot.,0,1,0,1,0
eng_train_track_a_01089,"The first one was far enough ahead that it didn't startle me so much.Anyway, for the gruesomely curious, here are some pics of my injuries: My elbow got the worst of it.",1,1,0,1,0
eng_train_track_a_01092,We're also thieves.,0,1,0,0,1
eng_train_track_a_01094,"Being a `` part-time vampire '', hanging by my toes during the morning hours during vacation, I spent a few hours that early morning loading stuff.",0,0,1,0,0
eng_train_track_a_01095,"I'm trying to bribe them, keep them happy, and keep the steam from coming out of my ears, since i don't really know how to photoshop steam out.",1,1,0,0,0
eng_train_track_a_01096,"I would wake up sometime later shaking, perhaps trying to rid myself of the sleep paralysis.",0,1,0,1,0
eng_train_track_a_01097,First: I WANT TO KNOW ABOUT *YOUR* DAY!,0,0,1,0,0
eng_train_track_a_01099,I remember sitting on the curb putting it to my ear and listening to the music.,0,0,1,0,0
eng_train_track_a_01100,"I smashed my face with the box I was carrying, busted my lip and got blood all over my face, broke my glasses ( again! )",1,1,0,1,1
eng_train_track_a_01101,This one has haunted me for years...,0,1,0,1,1
eng_train_track_a_01103,At this point my cousin notices that his house is decorated entirely with circus clowns.,0,1,0,0,1
eng_train_track_a_01105,"My hand seemed to tremble more as I took the frail hand offered to me, feeling the protruding veins under my thumb.",0,1,0,1,0
eng_train_track_a_01106,"I moved my arms, stretching the muscles, watching ribbons of flesh dance around skin and bone.",0,0,1,0,0
eng_train_track_a_01107,"I could feel it on my back; cold, wet and aged.",0,1,0,1,0
eng_train_track_a_01108,"So when I am quiet, crying, angry... or my attitude just seems... different, let me close my eyes... and let me dream...",1,1,0,1,0
eng_train_track_a_01112,The bride floated down the aisle like a pageant queen.,0,0,1,0,1
eng_train_track_a_01114,Anyway we've been married almost nine years.,0,0,1,0,0
eng_train_track_a_01116,"The hike was pleasant enough at first, walking on a slight incline, enjoying the scenery and the multitude of grasshoppers ( sweet jaysis, some of them were soooo big I'm sure they had skeletons ) almost flying into my face every step or so, I thought `` Ah!",0,1,1,0,1
eng_train_track_a_01118,"This is what I recall... There was a sheet draped across my belly, vertically, so I couldn't see what was going on.",0,1,0,0,0
eng_train_track_a_01120,I have many memories of him sitting across from me and sucking on a pig's foot while I wrinkled my nose in disgust.,0,0,0,0,0
eng_train_track_a_01121,"As my friend Steve called for better directions and as he was getting them, I fell again thinking I could break and quickly put my foot on the curb.",0,1,0,1,0
eng_train_track_a_01122,So far in this class my eyes have been opened to the power of writing and the enjoyment it can bring to me.,0,0,1,0,0
eng_train_track_a_01123,Then Bodybag was on my case and was ordering a cell search and people were shoving the `` uppers '' into my hands to which I was there trying to hide them in my pockets and such.,1,1,0,0,0
eng_train_track_a_01127,"(yikes, no pun intended--on either count)",0,1,1,0,1
eng_train_track_a_01131,"But, when I feel the sand under my feet, hear the roar of the waves and the strength of the gulf winds pushing and pulling the water in a sacred motion, all else is gone.",0,0,1,0,0
eng_train_track_a_01132,"bummed Well, I have survived the colonoscopy and the scope down my throat.",0,1,0,1,0
eng_train_track_a_01133,I was like wtf.,1,0,0,0,1
eng_train_track_a_01136,and my entire right leg up to my hip was still sleeping.,0,0,0,0,0
eng_train_track_a_01137,"I whirl around, of course, and see nothing.",0,1,0,0,1
eng_train_track_a_01139,"Images of him dominating in all ways filled my head, haunting my dreams and fueling my fantasies.",0,1,0,1,0
eng_train_track_a_01140,"I land off-kilter and go crashing into the drum set and take a Hi-Hat to the center of my spine, severing my nerves and leaving me paralyzed.",1,1,0,1,1
eng_train_track_a_01143,Either way I was scared for my life that day...,0,1,0,0,0
eng_train_track_a_01144,"she is so intrusive in my life, I have issues at work.",1,1,0,1,0
eng_train_track_a_01147,"The brace however squeezes my leg flesh out the top and bottom of the brace, and makes my knee cap look like a brain when I straighten my leg, but whatever.",0,0,0,0,0
eng_train_track_a_01148,I politely decline and went home.,0,0,0,0,0
eng_train_track_a_01149,Then I got to a parking lot and got a funny idea in my head to toss it at a car.,0,0,1,0,0
eng_train_track_a_01150,My venomous snake story is less awesome but the end result is the same:,0,1,0,0,0
eng_train_track_a_01151,What demon likes peas?,0,0,0,0,1
eng_train_track_a_01154,I closed my eyes and took a deep breath.,0,1,1,0,0
eng_train_track_a_01156,"She is a nice religious girl, exactly like the one he wanted to be with.",0,0,1,0,0
eng_train_track_a_01157,"My heart is broke, There's nothing to steal.",0,0,0,1,0
eng_train_track_a_01158,"""How the hell did you get her down?!",1,1,0,0,1
eng_train_track_a_01164,"this lake... that my feet are now standing in... is not only the lake that Jesus calmed in mark 4, but it is also the very water that Jesus walked on!",0,0,1,0,1
eng_train_track_a_01165,"Just got x-rays, and at least my knee does not appear to be broken ( although they are sending the x-rays to a specialist to be sure ).",0,1,1,0,0
eng_train_track_a_01166,"My dad was in the car, my mom was signing medical consents, and my sister was holding my hand and telling me to breath to keep me calm.",0,1,0,1,0
eng_train_track_a_01168,"Everyone was rather distraught, as he was widely liked and respected.",0,1,0,1,0
eng_train_track_a_01169,"The room was small but brightly lit and I sat on a two-seater couch facing the counselor across the room, as opposed to lounging on my back while staring at the ceiling with the lights dimmed.So what did I learn?",0,0,0,0,0
eng_train_track_a_01172,I smoke weed alone I have a tendency to become hungry.,0,0,1,0,0
eng_train_track_a_01174,We cleaned up another 15-20 litres of wine and finished up by the boys lifting the flagon to my mouth while I sculled the last litre or so.,0,0,1,0,0
eng_train_track_a_01179,"hopeful Six months ago, I stood in a strange new place, my strange new home, in front of a fountain with a shiny penny in my hand.",0,0,1,0,0
eng_train_track_a_01185,I cringe because I have a morbid fear of STDs.,0,1,0,0,0
eng_train_track_a_01188,"Being insensitive and ignorant like that is completely uncalled for and that just made me sick.Even more, there are a couple people that get under my skin a bit.",1,0,0,1,0
eng_train_track_a_01190,"There isn't a lot left, so I'm going to summarize from this point on.",0,0,1,0,0
eng_train_track_a_01191,"We went out for pizza, everything was grand -- great conversation, no awkwardness -- until a friend of hers came up and started chatting, and then congratulated her on her new boyfriend, etc.",0,1,1,1,1
eng_train_track_a_01192,Instead I have to go down there to find them all drinking.,1,0,0,0,0
eng_train_track_a_01195,"I was eating and drinking well, my legs felt fresh, and other than a twinge in my achilles tendon, I felt on the ball.",0,0,1,0,0
eng_train_track_a_01196,I pulled a shard of bone out of my mouth.,0,1,0,0,0
eng_train_track_a_01197,"By Sharlyn Guthrie From the sea fate called to me, harmless ` round my ankles danced.",0,0,1,0,0
eng_train_track_a_01200,"Bitch daniel splashed fish water @ my face, lmfao.",1,0,0,0,0
eng_train_track_a_01202,That is how you single-handedly stop a zombie apocalypse.,0,0,1,0,1
eng_train_track_a_01204,"When I poked my head in the box to see how they were doing, the other one just let out a single peep!",0,0,1,0,1
eng_train_track_a_01205,"I could still feel glass showering down and now the cut on my head was bleeding pretty badly, I could taste the blood as it ran down my face and mixed with my sweat and hit my lips.",0,1,0,1,0
eng_train_track_a_01208,I was on a date with this woman.,0,0,1,0,0
eng_train_track_a_01209,My parents blame me.,1,1,0,1,0
eng_train_track_a_01210,"The interesting part is, i hear nothing.",0,1,0,0,1
eng_train_track_a_01219,for puttin my heart into it n come out cryin n sad.,0,0,0,1,0
eng_train_track_a_01220,His life was hell.,0,1,0,1,0
eng_train_track_a_01221,The waiter obliged though and did box the salad.,0,0,1,0,0
eng_train_track_a_01222,And soon well need more cabbage and potatoes.,0,0,0,0,0
eng_train_track_a_01223,"It was probably about 21:00, either way it had already gone very dark (was possibly winter time).",0,1,0,0,0
eng_train_track_a_01225,I still have a blank stare on my face.,0,0,0,0,0
eng_train_track_a_01226,"At one point, I got pissed at Bryce for holding my hands back while my cell phone rang.",1,0,0,0,0
eng_train_track_a_01228,"There, I was just inches away from him and for some reason, I felt the beating of my heart jump out from within me.",0,1,0,0,1
eng_train_track_a_01229,it's currently snowing big flakes outside and i'm crossing my fingers and hoping for a snow day.,0,1,1,0,0
eng_train_track_a_01235,A penny hit me square in the face.,1,1,0,0,1
eng_train_track_a_01236,At this point I am confident that my neck could actually heal completely which is unlike how I felt about it previously.,0,0,1,0,0
eng_train_track_a_01238,Thoight it was weird.,0,1,0,0,1
eng_train_track_a_01239,I was just crying so hard that the tears dripped off my chin and into the sink ).,0,1,0,1,0
eng_train_track_a_01242,"Makeing a sorta clam shell, or like someone praying but sideways., around my clentched fist.",0,1,0,0,0
eng_train_track_a_01244,I woke up around 10:30 with a million thoughts rolling through my head.,0,1,0,0,0
eng_train_track_a_01245,I caught a co-worker stealing my prescription migraine medicine.,1,1,0,0,1
eng_train_track_a_01248,"Shitty situation, dont protect yourself with guns unless shots have already been fired.",1,1,0,0,0
eng_train_track_a_01249,I looked down only to see a flashing red light buried in the dirt under my feet.,0,1,0,0,1
eng_train_track_a_01250,"I'm tired of fighting against you Life, I'm tired of getting up and going into work day after day even when I'm sick to my stomach and my head's throbbing.",1,1,0,1,0
eng_train_track_a_01252,Tears streaming down my face I say '' let this end be because of my own making. '',0,1,0,1,0
eng_train_track_a_01253,Every september I used to get a wicked case due to fluid in my ears caused by allergies.,0,1,0,1,0
eng_train_track_a_01254,i can see him staring from the corner of my eye i take a small glance and ask myself `` why? '',0,1,0,0,1
eng_train_track_a_01256,She lived in the boonies &amp; one night she was getting ready for bed when she glanced out the window &amp; saw a red flicker.,0,1,0,0,1
eng_train_track_a_01258,"I then started to cry again, with a doll in my arms.",0,0,0,1,0
eng_train_track_a_01260,I was sweating and panicked.,0,1,0,0,0
eng_train_track_a_01261,Meaningless at the time.,0,0,0,1,0
eng_train_track_a_01262,"It was dark but I could see my door was slightly open, and on the other side was from what I could tell a giant eye.",0,1,0,0,1
eng_train_track_a_01263,In college we had a lot of foreign students at school.,0,0,1,0,0
eng_train_track_a_01264,It was really beautiful but being half asleep I didn't want to wake up anymore and so I kept dozing in and out of sleep watching the sunrise for a few moments before closing my eyes again and drifting off to sleep.,0,0,1,0,0
eng_train_track_a_01266,I can see it in my head.,0,0,0,0,0
eng_train_track_a_01267,"It was a joyously frightening ride and as I went to get off the bike, I burned my leg on the exhaust.",0,1,1,0,0
eng_train_track_a_01268,"""That's were those people went missing"".",0,1,0,1,1
eng_train_track_a_01269,It was so fucking weird.,0,1,0,0,1
