id,text,anger,fear,joy,sadness,surprise
eng_train_track_a_00001,"Colorado, middle of nowhere.",0,1,0,0,1
eng_train_track_a_00003,It was one of my most shameful experiences.,0,1,0,1,0
eng_train_track_a_00004,"After all, I had vegetables coming out my ears all for the benefit of the young prince.",0,0,0,0,0
eng_train_track_a_00007,You know what happens when I get one of these stupid ideas in my head.,1,1,0,0,0
eng_train_track_a_00011,It's his reflection.,0,0,0,0,1
eng_train_track_a_00013,"i pushed standing up for a while and emerald crowned, but got pretty tired and laid on the bed on my side while matthias held my leg up and that's how emerald came out!",0,0,1,0,0
eng_train_track_a_00016,I remember being scared shitless.,0,1,0,0,0
eng_train_track_a_00017,That was the last time anyone saw her.,0,1,0,1,0
eng_train_track_a_00018,The stone inside my heart was removed; ).,0,0,1,0,0
eng_train_track_a_00019,"Not only was I not able to move, I smacked my head against the guy sitting in front me and things just got awkward.",1,1,0,0,0
eng_train_track_a_00020,I didn't see any light yet it still seemed to glow.,0,1,0,0,1
eng_train_track_a_00022,Remember the farm-ette?,0,0,1,0,1
eng_train_track_a_00023,I took offense to this because as a supervisor I wanted my team to be in good spirits and wanted them to love coming in to work and doing good things for the mission.,1,0,0,0,0
eng_train_track_a_00027,"She said that I shouldn't do ANYTHING with my finger, not even type.",0,1,0,0,0
eng_train_track_a_00029,Now when I have too much to do my brain just gets distracted by all the other jobs jostling for attention.,0,1,0,0,0
eng_train_track_a_00030,I expect them to come in the backdoor any second but I hear nothing.,0,1,0,0,1
eng_train_track_a_00031,The rattling in my brain clogs my nose.,0,1,0,1,0
eng_train_track_a_00032,I had to turn my head back into the stream of water just so I didn't burst out laughing and lose it right there.,0,0,1,0,0
eng_train_track_a_00033,"So when the laughing fit stopped, back to my seat I went with a big ole smile across my face.",0,0,1,0,0
eng_train_track_a_00035,Sets the power/entity free.,0,1,1,0,1
eng_train_track_a_00037,There was apparently then some awkward laughter and apologies and my grandpa and his friends were dismissed.,1,1,0,1,1
eng_train_track_a_00039,I got lie after lie.,1,1,0,1,0
eng_train_track_a_00040,"After scratching my head, I headed to the front yard, where there are no trees, on the off chance that something truly weird had caused a limb to plop down on my house.",0,1,0,0,1
eng_train_track_a_00041,"And I got ta tell you right here folks, that brings a tear to my eye.",0,0,1,1,0
eng_train_track_a_00045,It was one of the most spiritual moments of my life.,0,0,1,0,1
eng_train_track_a_00047,"As I started to jog easily to the starting line, my leg felt a little stiff and my shin was hurting a bit.",0,1,0,1,0
eng_train_track_a_00048,"i asked if anyone else just saw that and right on queue my best friend says ""that hand just reach out of the entertainment center?",0,1,0,0,1
eng_train_track_a_00051,painted on my face.,0,0,0,0,0
eng_train_track_a_00052,Nothing behind me either.,0,1,0,0,1
eng_train_track_a_00053,It felt so unreal...,0,1,0,0,1
eng_train_track_a_00054,She left the room and went downstairs.,0,0,0,0,0
eng_train_track_a_00056,I went into the closet to investigate and found nothing... /chills,0,1,0,0,1
eng_train_track_a_00057,I'm trying to work and accomplish things and train this other guy on how to help me with my job and I can't even move my head for fear of puking on my desk.,0,1,0,0,0
eng_train_track_a_00059,"Ah, to close my eyes and let time fly by, Because there's so much to gain By forgetting these dreams driving me insane.",0,1,0,1,0
eng_train_track_a_00060,"And then we have the ultimately retarded `` Spanish Lesson '' ( which I kind of like because it's so entertainingly bad ) and `` Incredible, '' which just flat-out gets on my nerves.",1,0,0,0,0
eng_train_track_a_00061,' I chanted in my head.,0,0,0,0,0
eng_train_track_a_00063,This expert also was the ex-husband of the murdered woman.,0,1,0,1,1
eng_train_track_a_00064,"I did manage to remember to hang out the washing, but only because the annoying beeping sound the washer makes when its finished a cycle finally filtered into my brain and started to irritate me enough that I couldn't ignore it any longer.",1,1,0,0,0
eng_train_track_a_00069,asked a flustered girl that bumped into my arm.,0,1,0,0,0
eng_train_track_a_00070,A sharp stinging stripe across the backs of my legs.,0,1,0,1,0
eng_train_track_a_00071,I really have to watch my mouth.,0,0,0,0,0
eng_train_track_a_00073,i was walking around cursing the day in my head.,1,1,0,1,0
eng_train_track_a_00074,I shook my head and willed every broken hearted thought to go away.,0,0,0,1,0
eng_train_track_a_00075,"i hope whatever i did do today, the two paper 2s adn the reading of the ntoes adn the definitaions i recited, stick in my head and i do nt forget anything: ( sigh.",0,1,0,1,0
eng_train_track_a_00076,"About 3 years ago I had a very vivid dream about my deceased aunt and uncle, Sylvia &amp; John.",0,0,0,1,1
eng_train_track_a_00079,"but my heart pounded in my chest and i couldnt breath, couldnt even look at him.",0,1,0,0,0
eng_train_track_a_00080,I was never so happy to have my feet on solid ground though.,0,0,1,0,0
eng_train_track_a_00081,They don't seem to be evil or dangerous.,0,1,0,0,0
eng_train_track_a_00082,I always like to head out into the boonies after I have been away for a long time... to get my head straight.,0,0,1,0,0
eng_train_track_a_00083,Sage grabbed my toothbrush this morning and showed me how to brush my teeth.,0,0,0,0,0
eng_train_track_a_00084,"I trust this man even less than the woman, but I can't put my finger on it.",0,1,0,0,0
eng_train_track_a_00088,FISHIN '' I woke up in the morning my head was throbing black and blue eyed thought I'd died smashed up my TV set.,0,1,0,1,1
eng_train_track_a_00090,"I filled it out and tried to stay calm, but my legs were still shaking!",0,1,0,0,0
eng_train_track_a_00096,And these were brutal wounds.,1,1,0,1,1
eng_train_track_a_00098,My eyes welled up with tears and my voice cracked.,0,1,0,1,0
eng_train_track_a_00099,"However, I made sure to take a few swishes of water just so my mouth felt like it got a lot of moisture.",0,0,1,0,0
eng_train_track_a_00105,The stench hit me first.,0,1,0,0,1
eng_train_track_a_00106,It was the dance of my heart.,0,0,1,0,0
eng_train_track_a_00109,"I feel like my stomach's had a growth spurt, which leaves me aching and sore.",0,1,0,1,0
eng_train_track_a_00114,"an hour after i got here my eyes swelled up and are so itchy, my athsma is ridiculous ( in vic i do nt even take medications!",0,1,0,1,0
eng_train_track_a_00115,"as usual, i feel like im carrying too much burdens in my heart.",0,1,0,1,0
eng_train_track_a_00116,"i hate the idea of not making progress, it breaks my heart to see time being wasted away, standing still-i hate the idea that i can not see the world.",1,1,0,1,0
eng_train_track_a_00117,But I spent two days reading and still didn't hit the end of this thread.,1,1,0,0,1
eng_train_track_a_00118,"But I was feeling really nervous, and my hands were sweaty.",0,1,0,0,0
eng_train_track_a_00119,and throw my hands in the air.,0,0,1,0,0
eng_train_track_a_00123,"I did as much time as I could on my feet for closing gate, but had to sit for stretch before cannon.",0,1,0,0,0
eng_train_track_a_00124,"The weather up there are super cozy, I went to wash my hand, the water are freezing!!!",0,1,0,0,0
eng_train_track_a_00126,"Nothing like the city to remind you that you are among humans and animals.ProActive Acne Shit Review: So, after only a week of using ProActive, I started to notice the difference in my skin.",0,0,1,0,0
eng_train_track_a_00127,She certainly has the right name... View at the glaciers in the distance.Me being silly... So I had a good morning before going to work and feeling the world-at least the hotel world-crumbling at my feet...,0,1,0,1,0
eng_train_track_a_00129,The nightmares and fear were new and inexplicable.,0,1,0,1,1
eng_train_track_a_00131,"The kissing and touching don't stop, they just get more... interesting.",0,0,1,0,1
eng_train_track_a_00134,We are earths last hope against extinction.,0,1,0,1,1
eng_train_track_a_00136,"Jimmy gently poured some into my mouth, dipping my head back and asking me to swallow.",0,0,0,0,0
eng_train_track_a_00137,Fast forward six months - I've moved to central Virginia for work.,0,0,1,0,0
eng_train_track_a_00138,( HUGE grin on my face now. ),0,0,1,0,0
eng_train_track_a_00142,My jaw nearly dropped.,0,0,0,0,1
eng_train_track_a_00143,"After i wash my face and brush my teeth, i go out from the kitchen and found that, someone sleep on my place, using my blanket and also pillow.",0,1,0,0,1
eng_train_track_a_00144,Not creepy but ghostly.,0,1,0,0,1
eng_train_track_a_00146,"Don't walk away, I'm talking to you, there's bruises on my face.",1,1,0,1,0
eng_train_track_a_00149,It better not be for my parenting.,1,1,0,0,0
eng_train_track_a_00150,Can I add a bridesmaid-zilla story?,0,0,1,0,1
eng_train_track_a_00151,We ended up keeping the old house and renting it out though.,0,0,1,0,0
eng_train_track_a_00152,"Most mornings I drift in and out, slowly shaking off the fuddle of sleep but yesterday I was right there with my eyes wide open and the clock saying eight.",0,0,1,0,0
eng_train_track_a_00154,Could be wrong though.,0,1,0,0,0
eng_train_track_a_00158,My mouth by then like cardboard.,0,0,0,0,0
eng_train_track_a_00159,I was scared shitless.,0,1,0,0,1
eng_train_track_a_00161,"As the blood seems to return to my head, I can think clearly and muster the energy to keep going.",0,1,1,0,0
eng_train_track_a_00165,"the next thing i knew, i felt this huge impact on my head, and then a few more after that.",0,1,0,0,1
eng_train_track_a_00168,They seemed quit some distance away from me.,0,1,0,0,0
eng_train_track_a_00171,As he approached the edge of it he took to prep hops.,0,1,0,0,1
eng_train_track_a_00173,I couldnt walk without tripping over her.,1,1,0,0,0
eng_train_track_a_00176,"We could have been part of organized crime, but my grandpa (who died before I was born) didn't want any part of it and decided to live an honest life.",0,0,1,1,1
eng_train_track_a_00178,I remembered back to last week when my neck was really hurting.,0,1,0,1,0
eng_train_track_a_00179,"The form itself did not shed any light, but was light.",0,0,0,0,1
eng_train_track_a_00180,"It was just a knick, but and the blood $ The rain was cold, but my tears were hot against my cheeks.",0,1,0,1,0
eng_train_track_a_00182,"This is typical, as they need to justify their existence.",1,0,0,0,0
eng_train_track_a_00183,Seemingly because the bartenders were very heavy handed.,1,0,0,0,0
eng_train_track_a_00184,& # x 26; nbsp; I folded my arms on the table and rested my head on my hands-but in a few moments there was a lot of tension in my jaw from this positon.,0,1,0,0,0
eng_train_track_a_00185,My pride hurt worse than my leg did.,1,0,0,1,0
eng_train_track_a_00187,Blotted out the moon.,0,1,0,0,1
eng_train_track_a_00189,I had just had a procedure done to implant an Intrathecal Baclofen Pump in my belly.,0,1,0,0,0
eng_train_track_a_00191,With sudden resolution I took my hands from the rail.,0,0,0,0,0
eng_train_track_a_00192,"The following two days, I was in a moderate amount of pain and had very limited range of motion in my arms.",0,1,0,1,0
eng_train_track_a_00195,"After the deception, but before the divorce.",1,1,0,1,0
eng_train_track_a_00196,It just... went away.,0,1,0,1,1
eng_train_track_a_00198,"Stuck in this place, With the world rushing by, Tears stream down my face, As I stand here, waiting to die.",0,1,0,1,0
eng_train_track_a_00199,the cold outside feels so good on my skin.,0,0,1,0,0
eng_train_track_a_00200,Several times in the last couple weeks I've had to scratch my head cleverly for a few minutes trying to figure out how to get into my office.,0,1,0,0,0
eng_train_track_a_00201,"Now, I just sit there and nod my head, as I listen to the excuses people use to not make positive changes in their life.",0,0,0,0,0
eng_train_track_a_00202,"Not moving, not menacing.",0,1,0,0,0
eng_train_track_a_00203,The first thought that came into my head was that I needed to go to work as soon as possible.,0,1,0,0,0
eng_train_track_a_00204,A rather regular occurrence happened at night upstairs.,0,1,0,0,0
eng_train_track_a_00207,"So many things were going on in my life, in my head and in my heart that I just couldn't write any of them down.",0,1,0,1,0
eng_train_track_a_00208,It felt so real that I actually woke up.,0,1,0,0,1
eng_train_track_a_00209,My ex-boyfriend was just a horrible liar.,1,0,0,1,0
eng_train_track_a_00210,The police were trying to calm him down.,0,1,0,0,0
eng_train_track_a_00212,Your son is not liking the strap around my belly. '',0,1,0,0,0
eng_train_track_a_00218,I was completely dumbstruck.,0,0,0,0,1
eng_train_track_a_00219,"As I was placing them in the `` to be thrown out '' pile, something caught my eye and made me look closer.",0,0,0,0,1
eng_train_track_a_00222,"She claimed I beat her, raped her, tortured, and abused her.",1,1,0,1,1
eng_train_track_a_00223,I had a lump in my throat several times.,0,1,0,1,0
eng_train_track_a_00225,"It started out slow, like we'd fight once a month over stupid little things and sometimes big things.",1,1,0,1,0
eng_train_track_a_00227,I will defend this to the grave.,1,0,0,0,0
eng_train_track_a_00228,Coupled with the sound of rotors deafeningly stunning my ears and the very air in and around the cab of my car.,0,1,0,0,1
eng_train_track_a_00230,"Staring down at the device, I felt this cold chill start at the base of my neck and spread throughout my body.",0,1,0,0,1
eng_train_track_a_00231,It was funny because I thought I broke my arm.,0,1,1,0,1
eng_train_track_a_00232,"idk why, my eyes just got really watery and i felt really scared and felt so lost all of a sudden: /",0,1,0,1,1
eng_train_track_a_00234,My heart melted.,0,0,1,0,0
eng_train_track_a_00237,The outer right side was throbbing in pain and shooting up to my ankle.,0,1,0,1,0
eng_train_track_a_00240,I will lose sleep.,0,1,0,1,0
eng_train_track_a_00241,Then we finally saw what was going on.,0,1,1,0,1
eng_train_track_a_00243,"When they are near me I either scream, or my mind goes blank and I saw whatever pops into my head ( no... seriously, it's kind of sad.",0,1,0,1,0
eng_train_track_a_00244,For dessert and coffee we went to another cafe down the street.,0,0,1,0,0
eng_train_track_a_00251,It was mutually beneficial.,0,0,1,0,0
eng_train_track_a_00252,Telling me I'm going to hell.,1,1,0,1,0
eng_train_track_a_00253,Only in my foot.,0,0,0,0,0
eng_train_track_a_00255,"I'd just started a new character on a different world than I usually play on, then this guy wants to join my party...",0,1,1,0,1
eng_train_track_a_00262,"There were dozens of us, crying, screaming, or in shock.",0,1,0,1,1
eng_train_track_a_00264,"My throat is now only a dull ache ( as one nurse said, strep throat is the throat you don't forget, boy was she right! )",0,1,0,1,0
eng_train_track_a_00265,I stopped a couple times to stretch out my calves and quads.,0,0,0,0,0
eng_train_track_a_00266,my stomach is all out of whack.,0,1,0,0,0
eng_train_track_a_00268,"I pulled it up, still heard the gushing sound, so I turned my head, and the other one stopped immediately.",0,1,0,0,0
eng_train_track_a_00269,The house is trashed.,1,1,0,1,0
eng_train_track_a_00270,They immediately started shooting meth and heroin.,1,1,0,1,1
eng_train_track_a_00271,Scary going up but terrifying going down into awful LA traffic.,0,1,0,0,0
eng_train_track_a_00272,"The part my grandfather said was broken and would lead to his doom, was broken.",0,1,0,1,1
eng_train_track_a_00273,"We first met hatred was in my eyes, I Didn't want anything to do with you, lies.",1,1,0,1,0
eng_train_track_a_00276,We wanted to put off going down route thumper (Never went through without being hit) well we had too anyway.,0,1,0,0,0
eng_train_track_a_00281,Threw my underwear away in their kitchen garbage.,0,1,0,0,1
eng_train_track_a_00283,"I feel my head hurting, and the next thing I know school's over, I'm in the front of it with him and Traci, and he's pointing a finger at me and sort-of-yelling-sort-of-talking, and saying `` You faker! ''",1,1,0,1,1
eng_train_track_a_00284,"She was Brazilian, or Chinese, or something weird.",0,1,0,0,1
eng_train_track_a_00285,so stop shoving shit down my throat and into my head.,1,1,0,0,0
eng_train_track_a_00286,I felt him press his face to my hair and start to whisper soothing things at me but I still couldn't hear anything but the pounding of my heart.,0,1,0,0,0
eng_train_track_a_00287,"Despite my anxiety, You were there with me, Diligently working in my heart, Stripping me of all of my pretense, Scourging me of all of my arrogance, Revealing each of my self-serving ways, Which have made my life a wasteland.",0,1,1,1,0
eng_train_track_a_00288,So I decide to just lean against the railing and smoke my cigarette with a stupid look on my face.,0,0,0,0,0
eng_train_track_a_00291,My eyes were glassed over.,0,1,0,1,0
eng_train_track_a_00292,"One day during practice, the question was read, ""Finish, the opening line of the traditional American song which begins, 'I wish I was-'""",0,0,0,0,1
eng_train_track_a_00293,"I just happened to hold the stresses and frustrations ( that most kids probably have with school, parents, new friends ) in my eyes.",0,1,0,1,0
eng_train_track_a_00299,") This event happened after the war, but before the wall went up.",0,0,0,0,1
eng_train_track_a_00302,They were extremely close.,0,0,1,0,0
eng_train_track_a_00303,I tried to fight but I received a strong hit on my back of the head and everything around became so dark.,1,1,0,1,1
eng_train_track_a_00304,"My eyes are half-closed, heavy from the liquor and not sleepin, but still they're watchful of the tender, who they suspect of fueling the glass every time I leave to piss.",0,1,0,0,0
eng_train_track_a_00305,"My throat felt like I was choking down hot, spiked coals.",0,1,0,1,0
eng_train_track_a_00306,I also brought my bike to the beach and held it over my head standing in the ocean.,0,0,0,0,0
eng_train_track_a_00307,"I had no strength to reach for it, although I craved for it-since the hot water stopped flushing my skin, I felt icy needles and blades of cold air attacking my skin.",0,1,0,1,0
eng_train_track_a_00308,"Still numb.The numbness never left my arm, it was crazy.",0,1,0,1,0
eng_train_track_a_00310,"My limbs wouldn't move properly then, nothingness.",0,1,0,1,0
eng_train_track_a_00312,He ended up skidding down the bark and scraping raw the insides of his thighs.,0,1,0,1,1
eng_train_track_a_00316,"I met my best female friend on omegle, she lives 3000 miles away from me and we have never met.",0,1,1,0,1
eng_train_track_a_00317,My heart is aching today.,0,1,0,1,0
eng_train_track_a_00319,"I tried my best to keep my revulsion hidden, for things like that tend to turn my stomach, especially when the vendors claim that it is art.",0,1,0,1,0
eng_train_track_a_00320,We never said anything but just continued home.,0,0,0,1,0
eng_train_track_a_00321,Standing in court on my 23rd birthday being sentenced was the most ball shattering terrifying moment of my life,0,1,0,1,1
eng_train_track_a_00324,It made me lose my balance and I had to lean against the bar and grab my head.,0,1,0,0,0
eng_train_track_a_00326,Then it began to snow... hard.,0,1,0,0,1
eng_train_track_a_00327,"I tried to punch him, but my arms were tied behind my back.",1,1,0,0,0
eng_train_track_a_00328,"Middle school, the entire 8th grade class had to do this thing called a ""cultural fair"" where we research our lineage/cultural roots, and present it after school at night for all families to see.",0,1,1,0,0
eng_train_track_a_00331,I certainly didn't.,0,0,0,0,0
eng_train_track_a_00332,"My skin blossomed in red blisters from the tape and from the places where the sheet was wrinkled against me -- such a Princess and the Pea thing, I know, but fascinating to the medical staff, who declared me to have `` bizarrely soft skin. ''",0,1,0,1,0
eng_train_track_a_00334,"Additionally, there was snow on the ground outside, but we found no footprints around the house and no mud or water in the kitchen where the intruder had been walking.",0,1,0,0,1
eng_train_track_a_00335,"Sorry I missed you, call you later.",0,0,1,0,0
eng_train_track_a_00339,i think its more like i want to write it down so its not trapped inside my head when i die.,0,1,0,1,0
eng_train_track_a_00340,Twice I got it in my hands but it slipped out and bashed itself into the window again.,1,1,0,0,0
eng_train_track_a_00341,"White male, middle aged, male pattern baldness, coke bottle glasses.",0,0,0,0,0
eng_train_track_a_00343,Be still my heart.,0,0,1,0,1
eng_train_track_a_00344,This shrapnel bomb shattered the pieces of plastic into my face and legs.,1,1,0,1,1
eng_train_track_a_00346,I closed my eyes and more tears glided down my cheeks.,0,0,0,1,0
eng_train_track_a_00349,"Of course, he realizes what she actually said after the fact.",0,0,1,0,1
eng_train_track_a_00350,"Geez, and I'm having a hard enough time paying for my own wedding!Anyway, I checked flights later in the week only to almost gouge my eyes out when I saw how much flights were now going for.",1,1,0,0,0
eng_train_track_a_00352,the blame too easy to place on my shoulders.,1,0,0,1,0
eng_train_track_a_00353,"I also wrote down on a piece of paper ""You are fascinating.",0,0,1,0,0
eng_train_track_a_00354,well come to know i slip on the egde of the pool i do this twisting action thing hit my hip or leg on the side of the pool and then fell in with all of my clothes on.,0,1,0,0,1
eng_train_track_a_00357,"Is it too hard to forget someone from the past, i wish i could, but its very hard, I think my heart is too big and i have to much room.",0,0,0,1,0
eng_train_track_a_00358,"Fox arose from his limp slumber, And drank cold water From my eyes.",0,0,0,1,0
eng_train_track_a_00359,I stop and wait.,0,1,0,0,0
eng_train_track_a_00361,The funeral home has since been shut down.,0,1,0,1,1
eng_train_track_a_00363,It leaves both my hands free to be able to type.,0,0,1,0,0
eng_train_track_a_00366,Ill pay you back!,0,0,1,0,0
eng_train_track_a_00367,"This did not seem to be a malicious spirit, just curious.",0,1,0,0,1
eng_train_track_a_00370,"Broke up a bit later, pretty sure she was/is bipolar.",1,1,0,1,0
eng_train_track_a_00371,"I remembered how I dragged his box into the bedroom and the way we had fallen asleep together, my arm dangling over the side of the bed to comfort him.",0,0,1,0,0
eng_train_track_a_00375,"I went up on stage and sang my heart out, and afterwards signed up to sing another song with Becca ( alas we ran out of time ), and though I don't know any dance moves, I got a bit of a rythm, so it was all good!",0,0,1,0,0
eng_train_track_a_00377,And now my lips are sealed.,0,0,0,0,0
eng_train_track_a_00379,"I first had weakness in my left hand and gradually lost the use of my hands, arms and legs.",0,1,0,1,0
eng_train_track_a_00381,"It wasn't easy, I told myself; I was running short of breaths and I believed my face was red and then pale ( or was it the other way round? )",0,1,0,1,0
eng_train_track_a_00383,But I really do know it is my heart speaking through me and i am being taken over by the heart and not the mind i feel inspired.,0,0,1,0,0
eng_train_track_a_00384,"That was a 16 hour day, 19 for most people, except I pulled a muscle in my back and couldn't move without being in excruciating pain.",0,1,0,1,0
eng_train_track_a_00387,"Ah, internet dating, it's a fun world.",0,0,1,0,0
eng_train_track_a_00388,"With this holy oath I set my foot upon the path, the Druid's Way, and I vow to make my dedication plain.",0,0,1,0,0
eng_train_track_a_00389,I decide to stay awake and just well sit on my laptop.,0,0,0,0,0
eng_train_track_a_00392,I caught a quite a few rip-able one and was really relishing the new board under my feet.,0,0,1,0,0
eng_train_track_a_00393,"Curtain pulled back, I shield my eyes for a moment, glare adjustment then neon colour washes over my face -- slack-jawed, open-mouthed awe $",0,0,1,0,1
eng_train_track_a_00396,The children felt like they were being told telepathically that there was great danger ahead.,0,1,0,0,1
eng_train_track_a_00401,"It was a weird feeling, building up in my chest and my head and then it all switched and I couldn't turn it back!Seriously, try it!First of all, I started off right-brained.",0,1,0,0,1
eng_train_track_a_00402,"`` Out of my mouth came, `` I didn't see Creepy... `` First of all my brain did not process, that I was trying to even say anything.",0,1,0,0,1
eng_train_track_a_00403,The gust grew stronger and stronger till I felt I was about to be lifted from my feet.,0,1,0,0,1
eng_train_track_a_00405,"I take his word for it, and close my eyes.",0,0,0,0,0
eng_train_track_a_00409,more funny than creepy being on this side of the story:,0,1,1,0,1
eng_train_track_a_00413,"My eyes scanned the place, looking for Cody and I found him; wrestling on the sand with monkey boy for a volleyball.",0,0,1,0,0
eng_train_track_a_00414,"I can't stand the gelatinous tomato soup bit, or the soggy noodle letters, or the taste.",1,1,0,0,0
eng_train_track_a_00415,I had worked and my hand's still hurt and all kinds of bullshit lazy Cleo reasons for not going out and having fun when I have time.,1,1,0,1,0
eng_train_track_a_00416,Both times catastrophically embarrassing for me.,0,1,0,1,0
eng_train_track_a_00417,there are just 2 small parts that stick out in my head and make me so happy.,0,0,1,0,0
eng_train_track_a_00420,"My eyes popped open, and logic dictated that I should let her go.",0,1,0,0,1
eng_train_track_a_00422,He looked completely lost.,0,1,0,1,0
eng_train_track_a_00423,"I cleaned naked, I cooked naked, I ate naked, I drove him around naked, I waited in the car naked.",0,1,0,0,1
