id,text,anger,fear,joy,sadness,surprise
eng_train_track_a_01270,"Jamming the finger in my mouth to suck on, I open my stinging eyes and look over to my nightstand.",0,1,0,1,0
eng_train_track_a_01271,"), and I've imagined an entire life for him, his family, and his friends.",0,0,1,0,0
eng_train_track_a_01274,I shook my head.,0,0,0,0,0
eng_train_track_a_01276,"Nothing in his bed, not on his pillow, not on the bed, not on any doorhandles...nothing.",0,1,0,1,1
eng_train_track_a_01278,What happened to my heart when it broke into pieces?,0,0,0,1,0
eng_train_track_a_01279,"I never saw that thing again, because evidently it was ""stolen"".",1,1,0,0,1
eng_train_track_a_01280,"I've spent tons of time in the desert, in the forest, camping, hiking.",0,0,1,0,0
eng_train_track_a_01282,"Not too long after my family left, a guy came in to hook me up to yet another machine briefly to check my breathing which proved to be labored but not dangerously slow ( a nurse came in later a gave me a little toy thing to exercise my lungs which helped a bit ) and another couple guys came in to take an x-ray of my lungs.",0,1,0,0,0
eng_train_track_a_01283,The pain was incredible.,0,1,0,1,0
eng_train_track_a_01291,My pencil is in my hand.,0,0,0,0,0
eng_train_track_a_01293,where my feet couldn't get warm enough while i slept and i had to wear booties while sleeping.,0,1,0,0,0
eng_train_track_a_01294,It buoyed up my heart.,0,0,1,0,0
eng_train_track_a_01297,"""Liutenant, we see the black patch.",0,1,0,0,1
eng_train_track_a_01299,"I stirred the surface of the water with my hand; my face wiped away, only to reform when the mirror settled down again.",0,1,0,0,1
eng_train_track_a_01300,"I throw my hands up in the air sometimes Sayin ' ay-oh, got ta let go I wan na celebrate and live my life Sayin ' ay-oh, baby let's go 'Cause we gon ' rock this club We gon ' go all night We gon ' light it up Like it's dynamite 'Cause I told you once Now I told you twice We gon ' light it up Like it's dynamite God, I wish I could.",0,0,1,0,0
eng_train_track_a_01301,""" I explain the promotion to them and he is quick to decide he wants three.",0,0,1,0,1
eng_train_track_a_01302,"I fell to my knees, my body shaking with the sorrow I held in me since I woke up.",0,0,0,1,0
eng_train_track_a_01303,For many months I learned to shower keeping my elbows close to prevent water from hosing off the ends and totally drenching the place.,0,1,0,0,0
eng_train_track_a_01306,"Warmth, acrossed my cheek from golden rays.",0,0,1,0,0
eng_train_track_a_01308,I go in and sit down at my usual seat.,0,0,0,0,0
eng_train_track_a_01309,"`` Well then, by all means, curl my toes. ''",0,0,0,0,0
eng_train_track_a_01310,"Ah, to close my eyes and let time fly by, Because there's so much to gain By forgetting these dreams driving me insane.",0,1,0,1,0
eng_train_track_a_01313,"I think, just a week or so until I have my Nala kitty back in my arms.",0,0,1,0,0
eng_train_track_a_01314,Quite the opposite-total sloth/stoner/drunk.,0,0,0,0,1
eng_train_track_a_01317,"i kind of bawled my eyes out at the end; i warn you, it is highly depressing!",0,0,0,1,0
eng_train_track_a_01319,=D but i took the ones written on my hands one!,0,0,1,0,0
eng_train_track_a_01320,I went walking the other day and froze my lungs out.,0,1,0,0,0
eng_train_track_a_01321,Thankfully it was witnessed by the counselor in full detail.,0,1,1,0,0
eng_train_track_a_01325,What was the aftermath?,0,1,0,0,1
eng_train_track_a_01326,"At this point I am starting to have an anxiety attack, but I keep listening.",0,1,0,0,0
eng_train_track_a_01327,"Today, I ventured to swim class where Reese spent the entire 10 ( to maybe 12 ) minutes we were in the pool softly crying, almost whimpering and licking my shoulder.",0,1,0,1,0
eng_train_track_a_01330,"The Tooth Fairy paid for my teeth in quarters, equivalent to my age in years.",0,0,1,0,0
eng_train_track_a_01331,i oblige and he says something about how i have fluid in my lungs and i need to cough it all out.,0,1,0,0,0
eng_train_track_a_01333,Sometimes I have difficulty feeling my feet-I much prefer the clouds.,0,1,0,0,0
eng_train_track_a_01334,By that point I felt like someone was stabbing my head with a sharp object.,0,1,0,0,0
eng_train_track_a_01337,My car door was still open so running into the street after it like a moron i tried getting into the car and winded up missing and getting stuck half in the car and half out getting drug across the street and finally ending up in someones yard when the car came to a stop after rolling over my foot with the tire.,1,1,0,1,1
eng_train_track_a_01339,"No noise at all, no lights, it wasn't pitch black either.",0,1,0,0,1
eng_train_track_a_01340,At least not right away.,0,0,0,0,1
eng_train_track_a_01341,Guys are trying to get in your pants.,1,1,0,0,0
eng_train_track_a_01343,"I witnessed as the age old rock tradition of holding up lighters spread across the 28,000 person deep crowd... lighting up the entire audience... the hair on my arms started to raise until I noticed that....",0,1,1,0,0
eng_train_track_a_01345,"Stretching until my toes were caught by the sheets and my fingertips brushed the headboard, I opened my eyes.",0,0,1,0,0
eng_train_track_a_01346,It hadn't been plugged in and cell phones keep time automatically.,0,0,0,0,1
eng_train_track_a_01347,"light and noise, they make my brain pound against my skull.",0,1,0,0,0
eng_train_track_a_01348,"It started storming outside, light at first but it got heavy, quick.",0,1,0,0,1
eng_train_track_a_01349,Freaked all 3 of us out.,0,1,0,0,1
eng_train_track_a_01351,"I always had my nose in a book when I was younger, and when I moved up here I lost interest.",0,0,0,1,0
eng_train_track_a_01352,She just saw red.,1,0,0,0,0
eng_train_track_a_01353,"At this point, everything goes quiet.",0,1,0,0,1
eng_train_track_a_01357,The afterimage lit up green and orange against my eyelids.,0,0,0,0,1
eng_train_track_a_01358,Then it hit me.,0,1,0,0,1
eng_train_track_a_01361,"""Yes Johnson"" ARcH replied.",0,0,0,0,1
eng_train_track_a_01365,"-one roommate never showered, end of the year garbage bags of trash were taken out from her suite.",1,0,0,0,1
eng_train_track_a_01366,I never got any waffles either.,1,0,0,1,0
eng_train_track_a_01367,This is my creepiest real story.,0,1,0,0,1
eng_train_track_a_01370,"Clearly, I need to get back on some technical trails and regain my footing there: ) My ankles have been spoiled on the easy pavement this winter!",0,0,1,0,0
eng_train_track_a_01372,It would be her first great grandchild.,0,0,1,0,1
eng_train_track_a_01373,I just sat there panting and wiping tears and mucus off my face.,0,1,0,1,0
eng_train_track_a_01378,"The park is a small field, the only way out is at one end with a small fence with a gate, otherwise it's closed off.",0,1,0,0,0
eng_train_track_a_01380,"To top it all off, my back started to sieze up, possibly due to compensation habits and stress worrying about the issue.",0,1,0,1,0
eng_train_track_a_01381,My brain screams at me as I force myself to sit on the toilet lid.,1,1,0,1,0
eng_train_track_a_01384,He had 4 inches and 40 pounds on me and I still won.,0,0,1,0,1
eng_train_track_a_01385,I was kind of scared of them.So my new knife sharpener came home with me last night and I sharpened all the knives I could lay my hands on.,0,1,0,0,0
eng_train_track_a_01388,Why does my heart beat so fast when I see this one person?,0,1,0,0,0
eng_train_track_a_01391,Unfortunately this one did not end the same way ours ended.,0,0,0,1,1
eng_train_track_a_01392,"In my head, I was like... this is shit!",1,1,0,0,0
eng_train_track_a_01393,We hit off immediately and became friends.,0,0,1,0,0
eng_train_track_a_01396,"The spark leaped through his body into mine, and then out my hand to the cart.",0,1,0,0,1
eng_train_track_a_01397,"(Also, excuse my writing, it's late)",0,0,0,0,0
eng_train_track_a_01398,Unfortunately she had been sick and decided to leave early.,0,0,0,1,0
eng_train_track_a_01400,I just broke up with a girl I had been dating for a pretty long while.,0,1,0,1,0
eng_train_track_a_01404,"Several hours of that was enough to put me flat on my back, so I took a nice long nap, then just rested for the remainder of the day.",0,1,0,0,0
eng_train_track_a_01405,She legged it back to house scared shitless.,0,1,0,0,1
eng_train_track_a_01407,"Something went horribly wrong at the first one and I found my head empty, my thoughts run away.",0,1,0,1,0
eng_train_track_a_01408,"Maybe my nose is often runny, but I can smell danger well enough.",0,1,0,0,0
eng_train_track_a_01410,She was super happy for M.,0,0,1,0,0
eng_train_track_a_01411,It's too late.,0,1,0,1,0
eng_train_track_a_01416,I couldn't sleep last night for the adrenaline running through my veins.,0,1,0,0,0
eng_train_track_a_01423,) is going to die tonight.,0,1,0,1,1
eng_train_track_a_01424,Only damage done was scarring and a broken collar bone.,0,1,0,1,0
eng_train_track_a_01425,Then it suddenly stopped.,0,1,0,0,1
eng_train_track_a_01426,wah my face all cringed up.,0,0,0,1,0
eng_train_track_a_01430,I was house-sitting for my grandparents.,0,0,0,0,0
eng_train_track_a_01431,"I repeatedly thought, ""I am NOT going there!"".",1,1,0,0,0
eng_train_track_a_01433,I immediately realized what had happened and tried to cover it up by gasping.,0,1,0,0,1
eng_train_track_a_01434,I then pushed myself up using my arms.,0,0,0,0,0
eng_train_track_a_01438,My feet started taking a heavy beating and the sun was burning my whole body.,0,1,0,1,0
eng_train_track_a_01439,"One flew up and landed on my knee, another kept trying to draw attention to himself by flying up just inches from my face.",0,1,0,0,1
eng_train_track_a_01441,"my eyes relaxed, and i relaxed for a while.",0,0,1,0,0
eng_train_track_a_01442,"Enthusiastic and filled with hope I entered the voting booth that was so small I had to duck to get in, and hit my head.",0,0,1,0,1
eng_train_track_a_01443,I'm pretty sure I know who you're talking about in this post.,0,0,0,0,1
eng_train_track_a_01444,I was very sad for that snake who only died because I was too stupid to leave it alone!,0,0,0,1,0
eng_train_track_a_01445,People curse at and even hit him.,1,1,0,1,0
eng_train_track_a_01447,Our classmate Mark had passed away late last night in his sleep.,0,1,0,1,1
eng_train_track_a_01448,He wasn't fucking with me either.,1,0,0,0,0
eng_train_track_a_01450,"But for a brief moment, my heart and mind started racing.",0,1,0,0,0
eng_train_track_a_01452,"My jaw was pretty messed up for a month or so (Swollen, couldnt eat without terrible pain.",0,1,0,1,0
eng_train_track_a_01454,"However, there is someone else who's trying to win my heart.",0,1,1,0,0
eng_train_track_a_01455,"The back half is dark and dense woods, overgrown, only one trail winding through.",0,1,0,0,0
eng_train_track_a_01456,As long as it doesn't feel as though my throat and tongue are swelling then there's not much to worry about I guess.,0,1,0,0,0
eng_train_track_a_01457,"probably towed by now"".",0,1,0,0,0
eng_train_track_a_01459,So what happens is we get there.,0,0,0,0,0
eng_train_track_a_01460,Alarms rang in my head.,0,1,0,0,0
eng_train_track_a_01462,"In that instant, this is what went through my brain.",0,1,0,0,1
eng_train_track_a_01463,"Turns out this big lug was basically 90% heart, 5% muscle, 5% brain.",0,0,1,0,1
eng_train_track_a_01464,"I've tried sewing pants and a skirt for Vivian but both turned out too short, so I'm sending them to Baby G. I burned my fingers four times in two days.",0,1,0,0,0
eng_train_track_a_01466,"I set off down the street, walking with my head tilted slightly downwards, hiding my face from view.",0,1,0,1,0
eng_train_track_a_01467,Let's hit it.,0,0,1,0,0
eng_train_track_a_01470,"Then, without warning, they disperse.",0,1,0,0,1
eng_train_track_a_01472,Swerved the car so I would make it.,0,1,0,0,1
eng_train_track_a_01473,Im wasting my time doing nothing with my sister's E5700 hanging on my neck.,0,1,0,0,0
eng_train_track_a_01474,And the turbulence and near-death experiences.I hurt my neck again too.,0,1,0,1,0
eng_train_track_a_01479,"In my grandmother's home, she blocked off the formal living-room and dining-room with ""baby gates"" to keep me and my siblings and cousins from getting in and breaking stuff like her good china and antique furniture.",0,0,0,0,0
eng_train_track_a_01480,"I rolled my eyes while following behind Kathy.Then the voice from behind me sternly said, `` Are you talking to me?!!!",0,0,0,0,0
eng_train_track_a_01482,"It was several years later that I realized that I had probably narrowly avoided being molested, kidnapped, or worse.",0,1,0,1,1
eng_train_track_a_01484,Mom asked us all to sit down and that's when my heart began to sink.,0,1,0,1,0
eng_train_track_a_01485,"I think I could've laughed my head off that night, except that I had to keep my head in place so I could laugh some more, haha.",0,0,1,0,0
eng_train_track_a_01489,"All the while, my foot throbbing.",0,1,0,0,0
eng_train_track_a_01490,I couldn't get my feet undone so I just... fell over.,0,1,0,0,0
eng_train_track_a_01491,I ate a delicious sandwich on an everything bagel and one of the seeds got stuck in between my teeth.,0,1,0,0,0
eng_train_track_a_01494,"I nodded, pulling my arms across my chest, hoping that the rain obscured the tears that ran from my eyes.",0,1,0,1,0
eng_train_track_a_01496,Youre not mad are you?,0,1,0,0,0
eng_train_track_a_01497,"let the masses who see my face, start speaking my name in harsh tones and cast-down eyes.",1,1,0,1,1
eng_train_track_a_01498,My balls hurt so badly that I could barely even walk.,0,1,0,1,0
eng_train_track_a_01500,"Moved into a new office, and being an internet company, it was important The internet worked..",0,1,1,0,0
eng_train_track_a_01501,She lifted my other hand to examine the pads of my fingers.,0,0,0,0,0
eng_train_track_a_01503,And my heart bleeds.,0,1,0,1,0
eng_train_track_a_01506,We met at dinner with mutual friends at a very fancy italian restaurant.,0,0,1,0,0
eng_train_track_a_01508,"You slid through me like a hot knife through butter under my skin, and never gone yet.",0,1,0,1,1
eng_train_track_a_01513,I naively walked up and stuck my head in the driver's window hole.,0,1,0,0,1
eng_train_track_a_01514,I realized I was now down to my last 20 Pound note and some coins ( which I have yet to figure out ) so I decided to keep my eye open for an ATM.,0,1,0,0,0
eng_train_track_a_01516,my legs were sore from yesterdays squats.,0,0,0,1,0
eng_train_track_a_01517,I stomped my foot in anger.,1,0,0,0,0
eng_train_track_a_01519,Scouts disguised as farts.,0,0,1,0,1
eng_train_track_a_01521,"I have obnoxious bug bite on my finger, ugh probably from going on that trail.",0,1,0,0,0
eng_train_track_a_01523,We had hiked for about an hour through the shallow water and were looking for cool rocks and other things in the river.,0,0,1,0,0
eng_train_track_a_01526,Some work had been done on the driveway.,0,0,0,0,0
eng_train_track_a_01528,I got to babysit my grandson but my back hurt the next day.,0,0,1,1,0
eng_train_track_a_01529,"I woke up one night, and my heart was racing I shake away the drowsiness and started tracing for what i had dreamt about moments before.",0,1,0,0,0
eng_train_track_a_01531,Slow down so I don't stub my toe when I'm running down the driveway to pick up my mail.,0,1,0,0,0
eng_train_track_a_01532,"Have i just made my first ""ghost poo""?",0,1,1,0,1
eng_train_track_a_01534,"In the single worst moment of 21.5 years, six martinis errupted from my mouth.",0,1,0,1,0
eng_train_track_a_01536,"As I walked down the steps, I thought I felt eyes on my back.",0,1,0,0,0
eng_train_track_a_01537,Four hours had passed.,0,0,0,0,0
eng_train_track_a_01538,"I wrote down this bit about one of my earliest school memories as part of a writing exercise about memory as a tool, and I've been dying to share it as I think it's quite funny.",0,0,1,0,0
eng_train_track_a_01543,It was the day after my 20th birthday.,0,0,0,0,0
eng_train_track_a_01544,"Despite that the city is called `` Sin City '', the city of Las Vegas catches my eye; the fact that my favorite movie is set in the city could be a main reason why.",0,0,1,0,0
eng_train_track_a_01545,"My back hurts, my sinuses are full of fluid, I have been suffering pretty bad depression since my folks were here this weekend, and I am excited because I got new towels.I am an old lady, regardless of how long I have existed.",0,1,1,1,0
eng_train_track_a_01547,"I stood up, still violently too high, and walked over to my friend, who was still on the ground.",0,1,0,1,0
eng_train_track_a_01548,"so he went a lil faster ( keep in mind we never went really fast ) and i lost the tray, hit my knee on the ground, and tried to hang on until he stopped!",0,1,0,1,1
eng_train_track_a_01552,Grant you I still don't have total use of my shoulder and I have to use my left arm for certain things but it was wonderful to drive again.,0,0,1,0,0
eng_train_track_a_01556,"All those feelings which he had buried deep in his heart, had now, after hundreds of years, risen up.",0,0,0,1,0
eng_train_track_a_01559,"A close friend set me up on a double date with her, her boyfriend, and the boyfriend's friend on Valentine's Day.",0,1,1,0,1
eng_train_track_a_01560,Murder is the better word.,1,1,0,1,1
eng_train_track_a_01562,"I found that when I changed my thoughts, it changed my heart.",0,0,1,0,0
eng_train_track_a_01563,"I saw some of the girls staring but they didn't say anything, well not to my face.",0,0,0,0,0
eng_train_track_a_01566,I always wanted to see one.,0,0,1,0,1
eng_train_track_a_01567,"He breathed on my face, nuzzled my hair with his nose and licked the top of my head.",0,0,1,0,0
eng_train_track_a_01568,Apparently my leg had fallen asleep and I didn't know it.,0,1,0,0,0
eng_train_track_a_01569,"Then there are the scabs, scratches and depressive scars all over my legs.",0,1,0,1,0
eng_train_track_a_01571,"TL:DR The love of my life tried to kill me, I killed her first.",1,1,0,1,1
eng_train_track_a_01572,I was on a (admittedly silly) adrenaline rush.,0,1,1,0,1
eng_train_track_a_01576,I got on the pole and went down till I could reach the seint with my foot and I pulled it under me and I got in.,0,1,0,0,0
eng_train_track_a_01579,"I adjusted to the noise inside my head, and in turn, my inner need to analyze and obsess died out.",0,1,1,0,0
eng_train_track_a_01581,echoing cruelly in my ears.,1,1,0,1,0
eng_train_track_a_01586,"When I first saw Tangled on Thanksgiving, it ate my brain.",0,0,1,0,1
eng_train_track_a_01588,"I made sure to run my hand along the length of that wall knowing that Brad Pitt, George Clooney & Matt Damon had stood there, sad but true!",0,0,1,1,0
eng_train_track_a_01589,"I had no other option, not with the way my heart started beating erratically at the mention of his name.",0,1,0,0,1
eng_train_track_a_01590,"The headwind down this piece of road was not good, I had my head down, not good for talking in as much oxygen as I could.",0,1,0,0,0
eng_train_track_a_01591,"So he should be eating the pizza I'm stuffing into my face, like a chipmunk.I understand the impulse these days.",0,0,1,0,0
eng_train_track_a_01592,I pretty much spent my whole entire New Year's crying my eyes out.,0,0,0,1,0
eng_train_track_a_01593,My ankles and front of shins felt stiff.,0,1,0,0,0
eng_train_track_a_01601,"Same girl, same exact process.",0,0,0,0,0
eng_train_track_a_01603,"I thought that was a pretty good idea ( by this point, my feet hurt a LOT from all the walking and standing around ) but I didn't want to pay to see a movie.",0,1,0,0,0
eng_train_track_a_01605,Scared the hell outta me.,0,1,0,0,1
eng_train_track_a_01606,"I feel bad for my employees too-they're all sad and call me almost everyday, and it really breaks my heart.",0,1,0,1,0
eng_train_track_a_01608,"= Okay blablabla ~ And then, the dentist check up my teeth.",0,0,0,0,0
eng_train_track_a_01612,This sucks...sorry dude.,1,0,0,1,0
eng_train_track_a_01613,"We were both quiet, and I closed my eyes.",0,0,0,0,0
eng_train_track_a_01614,It was horribly intriguing.,0,1,1,0,1
eng_train_track_a_01616,That night I sat at my computer and read about Rainbow Bridge and cried some more and I could actually feel my heart hurt with the pain of loss.,0,1,0,1,0
eng_train_track_a_01618,"Jenny, I, my throat choked when I hear my daughter's voice.",0,1,0,1,0
eng_train_track_a_01620,"they played the majority of the classics thank god, and i screamed my heart out which is why i have no voice right now.",0,0,1,0,0
eng_train_track_a_01626,This was on both sides of my chest.,0,1,0,0,0
eng_train_track_a_01627,One X-ray showed my foot from above and the other showed it from the side.,0,0,0,0,0
eng_train_track_a_01630,"I always try to remember these incidents whenever someone claims to have experienced something strange, and realize that my stories would sound just as loopy to them.",0,0,0,0,0
eng_train_track_a_01635,"Suddenly I see it crouching on the floor, its bagged head hung low beneath its shoulders.",0,1,0,0,1
eng_train_track_a_01637,Entire room goes silent.,0,1,0,0,1
eng_train_track_a_01640,Not to mention the top portion doesn't fit my belly so therefor i have the top button undone.,0,0,0,0,0
eng_train_track_a_01641,This is my fucking breaking point.,1,1,0,0,0
eng_train_track_a_01642,Happy birthday to you and me!,0,0,1,0,0
eng_train_track_a_01643,My great-grandparents had an arranged marriage.,0,0,0,0,1
eng_train_track_a_01645,"My left clav essentially blew up, but it didn't stop there.",0,1,0,0,1
eng_train_track_a_01647,"xD As of now, I'm getting tired all the time and my belly is getting firm already.",0,1,1,1,0
eng_train_track_a_01648,He was pretty scared and was talking fast.,0,1,0,0,0
eng_train_track_a_01649,I go fucking ballistic.,1,1,0,0,0
eng_train_track_a_01650,"He said yes, I closed my eyes, and seeking from divine, I sang precisely two lines, describing, my wishes for him.",0,0,1,0,0
eng_train_track_a_01652,It disconnected and teetered away from us.,0,1,0,1,1
eng_train_track_a_01659,We roll up to the drive thru and proceed to order nearly the entire dollar menu.,0,0,1,0,0
eng_train_track_a_01660,I bent my knee inward.,0,0,0,0,0
eng_train_track_a_01661,I thought she was stuck-up and nerdy.,1,0,0,0,0
eng_train_track_a_01665,Needless to say I was pretty...unaffacted about the fact my brother knew who I was on reddit and thought his way of telling me was pretty funny.,0,0,1,0,1
eng_train_track_a_01666,I quickly fell asleep.,0,0,1,0,0
eng_train_track_a_01668,The second entry of today: / my brain hurt for answering 30 math question in one day.,0,1,0,0,0
eng_train_track_a_01669,My eyes had been closed and as I had opened them everything seemed to metirialize infront of me like a liquid curtain dropping infront of me.,0,1,1,0,1
eng_train_track_a_01670,"During the complete silence that follows, my grandfather says loudly ""Well, my god has spoken""",0,0,0,0,1
eng_train_track_a_01672,I have no idea what manki is so I have no idea where to look.,0,1,0,0,1
eng_train_track_a_01674,Dad on the warpath.,1,1,0,0,0
eng_train_track_a_01675,"I couldn't make out any clear distinct facial features, but I could see two darker circles where eyes would be, and a small oblong shape for a mouth.",0,1,0,0,1
eng_train_track_a_01678,As We were going into our 11th month.,0,0,0,0,0
eng_train_track_a_01679,"When i was very ill, in great suffering-such pain that even my skin hurt-i gave up.",0,1,0,1,0
eng_train_track_a_01681,My eyes start closing and my body starts aching all over.,0,1,0,1,0
eng_train_track_a_01682,Brighter than if you turned on every light in the room and even brighter than during the day time with the shades up.,0,0,0,0,1
eng_train_track_a_01683,"As soon as we stop making distinctions, we eliminate racism.",0,0,1,0,0
eng_train_track_a_01684,We had absolutely nothing in common.,0,0,0,1,0
eng_train_track_a_01685,Apparently it wasn't as life threatening as I believed at the time because the doctor didn't want to mar my forehead with stitches so I got butterfly bandages instead.,0,1,0,1,0
eng_train_track_a_01686,"Creepy place, never been a fan.",0,1,0,0,0
eng_train_track_a_01691,On this monday I went in to get my radiation treatment and couldnt stop crying from the pain in my leg.,0,1,0,1,0
eng_train_track_a_01693,As time passed it became quite the fancy outlet for my extreme ( sometimes intolerable ) idiosyncracies and papyrus on which to record both my daily happenings and ( most importantly ) some of my innermost thoughts that I wanted to tell the select few that i hold dear and close to my heart.,0,0,1,0,0
eng_train_track_a_01694,"They never shut up, although they usually apologize ( and immediately start screeching again ) whenever I cringe and cover my ears, which is often.",1,1,0,0,0
eng_train_track_a_01695,And I dongak my head to see who was in front of me.,0,0,0,0,0
eng_train_track_a_01698,""" She was slapping at air, screaming.",0,1,0,1,1
eng_train_track_a_01704,"I took my shirt off and washed my face, hands and arms then I took a paper towel and slowly washed my belly.",0,0,0,0,0
eng_train_track_a_01705,"A week after turning in the paper, I get an email from the professor saying I plagiarized the whole thing off Wikipedia.",1,1,0,1,1
eng_train_track_a_01707,"I see two small ""children"", floating about 4 ft. away from me.",0,1,0,0,1
eng_train_track_a_01708,He lives behind a church and part of his backyard boarders the parking lot in back of the church.,0,0,0,0,0
eng_train_track_a_01709,"I never said anything because it wasn't scary, just weird.",0,1,0,0,1
eng_train_track_a_01711,"While packing up our booth at CHA, I momentarily threw my back out.",0,1,0,0,0
eng_train_track_a_01713,So I grabbed my knife out of fear and looked up but there was nothing there.,0,1,0,0,1
eng_train_track_a_01714,"As the ocean roiled and seethed sturdy arms lifted my head, bidding me to simply breathe $ `` Breathe! ''",0,1,0,0,0
eng_train_track_a_01717,"None the less, she was breathtaking.",0,0,1,0,1
eng_train_track_a_01719,This is my story.,0,0,0,0,0
