id,text,anger,fear,joy,sadness,surprise
eng_train_track_a_00002,This involved swimming a pretty large lake that was over my head.,0,1,0,0,0
eng_train_track_a_00010,Hondas are notoriously great cars for long trips for their dependability and great gas mileage.,0,0,1,0,0
eng_train_track_a_00015,"Fortunately the kindly ajeoshis and ajummas that I rented the scooter from helped me get on a bus to the other ferry, but not before pulling me up a seat to thier table and shoving succulant watermelon in my face.",0,0,1,0,1
eng_train_track_a_00050,I had a chocolate and got up my nerve to ask about the games.,0,1,1,0,0
eng_train_track_a_00055,All of it on top of my head.,0,1,0,0,0
eng_train_track_a_00066,"Back in 2006 when I was in high school I took Earth Sciences, and in the spring I was on my teacher's computer when I came across a photo of me giving the thumbs up.",0,0,1,0,1
eng_train_track_a_00078,`` I went to put my hand in my pockets and realised what they'd done.,0,1,0,0,0
eng_train_track_a_00085,I guess i pointed to Jenny without hesitation.,0,0,0,0,0
eng_train_track_a_00093,"Needless to say, I turned her down.",0,0,0,0,0
eng_train_track_a_00101,""" ""look... out your window.",0,0,0,0,1
eng_train_track_a_00108,I thought it was a joke.,0,1,0,0,1
eng_train_track_a_00113,"She was rude to our photographer, she was rude to a few guests, and to us.",1,0,0,0,0
eng_train_track_a_00120,Then the cop shows up.,0,1,0,0,1
eng_train_track_a_00122,"I fumbled my way toward the light, and my fingers closed around the doorknob.",0,1,0,0,0
eng_train_track_a_00128,My heart beat so fast when the beautiful man give Yunho a peck on his left cheek.,0,1,1,0,0
eng_train_track_a_00135,Went to a party at a friends house.,0,0,1,0,0
eng_train_track_a_00148,I saw peppermint patties.,0,0,1,0,1
eng_train_track_a_00153,`` My God $ '' `` What's wrong with my arm? '',0,1,0,0,1
eng_train_track_a_00157,"She opened the door of the moving vehicle, jumped out, and landed on her feet.",0,1,1,0,1
eng_train_track_a_00163,"But well need large plastic bags, I dont know where to get those.",0,1,0,0,0
eng_train_track_a_00166,"I turn around, hoping my back hid part of my drawing and look down at the paper in front of Ryutaro, my hand only inches away from his and start to explain the directions a little clearer to him.",0,0,0,0,0
eng_train_track_a_00174,You know the ones?,0,0,0,0,1
eng_train_track_a_00197,"It was REALLY nice to feel the sun on my face because the winter blues really are real-for me at least: ) It was Brent's birthday while we were there, and my awesome family throw him a little birthday party ( I was so glad that I didn't have to do a thing )!",0,0,1,0,0
eng_train_track_a_00214,But it was good; it kept me on my feet for a long while.Knee?,0,0,1,0,0
eng_train_track_a_00226,I fell asleep with visions of 5 grand dancing in my head.,0,0,1,0,0
eng_train_track_a_00238,My heart starts pounding as my eyes scroll up the dress and it was Scarlett.,0,1,0,0,1
eng_train_track_a_00242,"I jumped up frantically ( the receptionist cast an odd glance toward me, and some net users stared ) and looked at my hands.",0,1,0,0,0
eng_train_track_a_00246,"my head looked up automatically, and the first person out of the others out there, i saw him.",0,1,0,0,1
eng_train_track_a_00248,First college room mate ever.,0,0,1,0,1
eng_train_track_a_00254,"I want to learn about you, communicate with you.",0,0,1,0,0
eng_train_track_a_00261,"My hands are usually cool, and I defend them, spouting `` Cold hands, warm heart! ''",0,0,1,0,0
eng_train_track_a_00277,"I had an ant crawling on my elbow just now, and I flicked him off.",0,1,0,0,0
eng_train_track_a_00279,She commented on everything that went into my mouth.,1,0,0,0,0
eng_train_track_a_00280,I felt a gun pressed against my forehead and looked up.,0,1,0,0,1
eng_train_track_a_00289,"So many people from my family have seen someone in the reflection, always in the same place, matching the same description.",0,1,0,0,1
eng_train_track_a_00301,"Once we got them all back into the room, one little girl ( the youngest of this group ) roughly pushed a little boy who was standing near me ( I was sitting with my legs blocking the doorway ) into the door jamb in her attempt to get out.",0,1,0,0,1
eng_train_track_a_00325,"So, I am from a science background and analyze everything skeptically.",0,0,0,0,0
eng_train_track_a_00333,I was still naked.,0,1,0,0,1
eng_train_track_a_00337,It was very weird.,0,1,0,0,1
eng_train_track_a_00345,"I also remember the chandelier campfires, and it was what inspired me for almost a year to tape pieces of mirror under my eyes so I could pretend I was walking on the ceilings ( though I always got a bit freaked out when I walked outside ).",0,1,0,0,0
eng_train_track_a_00348,That's pretty creepy.,0,1,0,0,1
eng_train_track_a_00369,"In order to buy food at the festival, you have to go to a tent and buy food tickets.",0,0,0,0,0
eng_train_track_a_00372,My friend set me up on a blind date with this woman.,0,1,1,0,1
eng_train_track_a_00419,I was so eager and excited to leave to the point I had butterflies in my stomach.,0,0,1,0,0
eng_train_track_a_00431,"We all decided to calm down, we thought that it was probably something when your phone activates something, thats all.",0,1,0,0,1
eng_train_track_a_00440,"*With a screech, the green witch snatched her broom and flew out her window.",0,1,0,0,1
eng_train_track_a_00442,"Not a great first impression, but we brush it off.",1,0,1,0,0
eng_train_track_a_00444,He ran outside with it to find this man at the bottom of our driveway.,0,1,0,0,1
eng_train_track_a_00457,at first was okay when i let my sleeve down during duty was like so freaking warm inside my hand please.,0,0,1,0,0
eng_train_track_a_00458,"Vomit lots, and lots.",0,1,0,0,0
eng_train_track_a_00478,A smile spread across my face.,0,0,1,0,0
eng_train_track_a_00494,"I can see you, I can see you, I can see you.",0,1,0,0,1
eng_train_track_a_00495,"I squeeze my eyes shut to stop the replaying of frames I've just witnessed, tighten my legs, and point my toes which I always do when I want to come.",0,1,0,0,0
eng_train_track_a_00506,"It felt good in my hands, it felt RIGHT.",0,0,1,0,0
eng_train_track_a_00526,"And through all this, she smiled and was positive and still views it as a perfect day.",0,0,1,0,0
eng_train_track_a_00527,I rolled my eyes.,1,0,0,0,0
eng_train_track_a_00561,The parallel universe answering machine:,0,0,0,0,1
eng_train_track_a_00564,Called it right away.,0,0,0,0,0
eng_train_track_a_00567,"It is a huge property with an 1850's settlement house, large interpretive/nature center, replica native american village, and about 100 acres of old growth oak forrest with hiking trails.",0,0,1,0,1
eng_train_track_a_00573,"We paid $269 for our standby tickets, and one first-class seat was about $11,000.",1,0,0,0,1
eng_train_track_a_00577,"Our G-mail accounts are one letter apart, mine having an ""L"" in the middle for my middle initial.",0,0,1,0,1
eng_train_track_a_00587,In the eastern States right up to my neck of the woods in Canada.,0,0,0,0,0
eng_train_track_a_00590,"Pauly and I went over to the PokerStars party and I downed some pork tenderloin, caesar salad, and tortellini with pesto sauce along with one Bahama Mama ( a tasty pink rum concoction ) to settle my nerves.",0,1,1,0,0
eng_train_track_a_00617,"and then i feel my heart join in the fun, crazy racing rabbit shit.",0,0,1,0,0
eng_train_track_a_00624,"And I said, `` Hey wait a second, one of the songs titles sounds familiar... `` AFTER MONTHS OF WRACKING MY BRAIN, I HAVE THE TITLE AND SONG ITSELF.",0,0,1,0,1
eng_train_track_a_00632,"Now the sunshine is out and bright against my right side of my face, just like it was after I had my hair done.",0,0,1,0,0
eng_train_track_a_00636,I had a really nice boss and a kush part-time accounting job during college.,0,0,1,0,0
eng_train_track_a_00641,There was chinchilla poop *everywhere*.,1,1,0,0,1
eng_train_track_a_00653,"Oh well, Bride's Day, Bride's Way!",0,0,1,0,0
eng_train_track_a_00660,Hit it off really well.,0,0,1,0,0
eng_train_track_a_00661,I had my eye on the fabric for months.,0,0,1,0,0
eng_train_track_a_00664,"i got a labrador puppy for my 4th birthday, greatest present ever.",0,0,1,0,1
eng_train_track_a_00665,"Shadows Falls new CD `` Threads of Life '', in my eyes, can be placed alongside '' The Art of Balance '' and `` The War Within ''.",0,0,1,0,0
eng_train_track_a_00666,"""Jeff what is that?",0,1,0,0,1
eng_train_track_a_00685,another thing that bothers me is that sometimes i stick my neck out for people at work and i do nt even get a thank you.,1,0,0,0,0
eng_train_track_a_00710,I guess those 3 beers I drank down at 6 went straight to my head.,0,0,1,0,0
eng_train_track_a_00713,Luckily the security guard is cool with me and let me stay.,0,0,1,0,0
eng_train_track_a_00714,I thought maybe the warmth of my skin could coax the color back into existence.,0,0,0,0,0
eng_train_track_a_00716,"I now wore a 36B bra, and my waist was down to 25 inches, but she insisted.",0,0,0,0,0
eng_train_track_a_00719,"I woke with a start, a sudden chill that spread to the tip of my nose, and found a small note resting delicately on my sheets beside my hand.",0,1,0,0,1
eng_train_track_a_00734,"Nothing, so if i can illuminate the flying object, then i will have a rough estimate about its height.",0,1,0,0,1
eng_train_track_a_00739,I learned a lot about my teeth during my visit today.,0,0,1,0,0
eng_train_track_a_00742,I can even lift my arms above my head.,0,0,1,0,0
eng_train_track_a_00747,Met a lot of random canadians that night.,0,0,1,0,1
eng_train_track_a_00756,"After like two seconds of that, we start *flying* forward and *smash through the parking barrier*, stopping *right by* the edge of the street.",0,1,1,0,1
eng_train_track_a_00760,That was poop on her Croc.,0,0,0,0,1
eng_train_track_a_00774,But then it got so hot I opened it and welcomed the cold spray on my face.,0,0,1,0,1
eng_train_track_a_00776,"I cocked my head like the RCA Victrola Dog, and sure enough -- key in door sounds.",0,0,1,0,0
eng_train_track_a_00777,BUT OH GOD MY NAILS ARE BLACK CALL A PRIEST.,0,1,0,0,1
eng_train_track_a_00785,It was friggin' delicious.,0,0,1,0,0
eng_train_track_a_00788,"After those few seconds, I waved one hand at it in a friendly manner, it then changed light pattern and hovered away behind my house.",0,1,1,0,1
eng_train_track_a_00789,"`` Mr. Jackson just called me, and he told me to call you, and told me to ask you so he didn't have to call you, and that's why I 'M calling you for him -- '' I broke out giggling and rushed to cover my mouth, stealing an embarrassed glance at all the nurses watching me in complete awe.",0,0,1,0,1
eng_train_track_a_00791,Ugh I know for sure I'm a do my eyebrows.,0,0,1,0,0
eng_train_track_a_00818,"My eyebrows raise as I smile, ` Ready for the second shot?",0,0,1,0,0
eng_train_track_a_00821,Please feel free to comment any questions,0,0,1,0,0
eng_train_track_a_00832,They did the same thing come Mother's Day but guess what?,1,0,0,0,1
eng_train_track_a_00839,"After getting all warm, I went and got my nails done.",0,0,1,0,0
eng_train_track_a_00850,trying to put some gel on my head.,0,0,0,0,0
eng_train_track_a_00862,( Notice my toes have nail polish on-that was New Year's resolution # 21 $ ) Then Esm decorated the body tracing.,0,0,1,0,0
eng_train_track_a_00878,A nice way to get some items off my chest.,0,0,1,0,0
eng_train_track_a_00902,Like I found a way to escape gravity and moved about my bedroom as though I was on the ISS or something; thrilling at my new found ability.,0,0,1,0,1
eng_train_track_a_00915,So anyways it's late at night and I was down in my living room sleeping on my couch.,0,0,0,0,0
eng_train_track_a_00932,"So they decided to throw me a ""90s McDonalds"" Birthday party.",0,0,1,0,1
eng_train_track_a_00936,"`` I had to think about that for a second, and do the math in my head.",0,1,0,0,0
eng_train_track_a_00942,They buy energy from 'energy generators' and sell it to you the customer.,0,0,0,0,0
eng_train_track_a_00944,"I jumped out wrapped a towel around me, dried off my hand and face and answered it.",0,0,0,0,0
eng_train_track_a_00952,W-WORST HABIT: Not washing my face before I go to bed.,0,0,0,0,0
eng_train_track_a_00956,"Fast forward-I was 21, and living in my first apartment.",0,0,1,0,0
eng_train_track_a_00957,My Heart was just... beautiful.,0,0,1,0,0
eng_train_track_a_00958,Decide to be roommates.,0,0,1,0,0
eng_train_track_a_00959,and my hair was straight and nice already so i pull a sweater over my head and jump into some jeans run to the bathroom brush my teeth while combing my hair with my fingers grab my purse and im out the door with sunglasses on cuz i got no makeup on... so i get to the bus stop and realize... I forgot to put out the bottles and a check for the waterman who comes at 9 AM!,0,1,0,0,0
eng_train_track_a_00961,Or like when the one of the 4-year-olds I substitute taught at church asked why I was wearing a belt around my waist.,0,0,0,0,1
eng_train_track_a_00965,A few years ago I worked for an apartment rental agency in a customer service role.,0,0,0,0,0
eng_train_track_a_00972,I could see them all.,0,0,1,0,1
eng_train_track_a_00976,"My heart still flutters when I think about it, it was just amazing.",0,0,1,0,0
eng_train_track_a_00978,in a rather large company.,0,0,0,0,0
eng_train_track_a_01019,One time in high school my friends and I had a dance party in someones basement.,0,0,1,0,0
eng_train_track_a_01024,Second story (equally creepy):,0,1,0,0,1
eng_train_track_a_01049,"Still, a creepy happening.",0,1,0,0,1
eng_train_track_a_01054,I brought my head up to the edge of the grass and peered towards the road.,0,0,0,0,0
eng_train_track_a_01066,The silent one looked increasingly nervous.,0,1,0,0,0
eng_train_track_a_01073,"Was a routine trip, 11 miles to RWC motoring and into a southerly wind, more wind than we saw during race time and with the sun straight in my eyes most of the way down.",0,1,0,0,0
eng_train_track_a_01088,So we get there and order some drinks.,0,0,1,0,0
eng_train_track_a_01113,Instinctively I turned my head to see who was coming in.,0,1,0,0,0
eng_train_track_a_01115,I did as little as possible with my right hand on Sunday and took a long nap with my hand in an elevated and comfortable position Sunday afternoon.,0,0,0,0,0
eng_train_track_a_01126,"` Captain, ' Ianto said timidly, poking his head around the door.",0,1,0,0,0
eng_train_track_a_01128,strange that happened to me once long ago.,0,1,0,0,1
eng_train_track_a_01130,The trap door was wide open.,0,1,0,0,1
eng_train_track_a_01142,The whole bathroom was very elegant and nicely decorated.,0,0,1,0,0
eng_train_track_a_01146,"I went to an off broadway show, which was a wedding.",0,0,1,0,1
eng_train_track_a_01155,I turned around so I could see my back.,0,0,0,0,1
eng_train_track_a_01159,"Ok, I'll tell you something which is both very creepy and very, very real.",0,1,0,0,1
eng_train_track_a_01160,The next day I got a tetanus shot.,0,1,0,0,0
eng_train_track_a_01163,"This leads to the neeed to suffle around and makes my legs fall asleep after not too long, which obviously isn't advisable.",0,1,0,0,0
eng_train_track_a_01170,"Well, I was being nice and throwing our trash away at Sonic... he started to back up, so I slammed my hands on the front of the car, so he started to pull forward... I laughed, finding it funny, and then I slowly realized that the car was against my shins and my feet were under the bumper of the car.......",0,1,0,0,1
eng_train_track_a_01193,"""Well I have loads, you can share mine"".",0,0,1,0,0
eng_train_track_a_01203,"When I pulled her back in, her hand went to the perfect spot on my chest.",0,0,1,0,0
eng_train_track_a_01217,So I got my hand on the Healthy wear powder foundation in creamy beige for $ 3.45.,0,0,1,0,0
eng_train_track_a_01218,"There was the tiniest pause in my head for a moment, as I looked round at her.",0,1,0,0,0
eng_train_track_a_01224,"While we were swimming, I went out where it was almost to my shoulders.",0,1,1,0,0
eng_train_track_a_01251,"Oh, this thread is perfect.",0,0,1,0,0
eng_train_track_a_01285,I started smoking there.,0,0,0,0,0
eng_train_track_a_01287,"I pushed her away, looked at the other pups, played, and did all the little `` tests '' but, every time someone turned loose of that the little female pup, she simplly walked over, and crawled in my lap, licked my hand.",0,0,1,0,0
eng_train_track_a_01288,I used to work for a UK energy company and through asking the right people the right questions I learned about the distribution gap.,0,0,1,0,0
eng_train_track_a_01289,"During the long and high vocals at the end, hair stood up on the back of my neck.",0,1,0,0,1
eng_train_track_a_01290,I think my eyes shut immediately after my head hit that pillow.,0,0,1,0,0
eng_train_track_a_01298,My hands were full.,0,0,0,0,0
eng_train_track_a_01305,Maybe I should try to get my hands on some.,0,0,0,0,0
eng_train_track_a_01312,I most certainly had change.,0,0,0,0,0
eng_train_track_a_01316,"My arms reached forward, and I grabbed on to his leg.",0,0,0,0,0
eng_train_track_a_01318,"Now, we just gotta get it home.",0,0,1,0,0
eng_train_track_a_01324,I get close enough to see the empty bottle and it starts moving a little.,0,1,0,0,1
eng_train_track_a_01329,"So I tried to make things as simple as possible, even though it was a pretty fancy wedding (my mom's standards).",0,0,1,0,0
eng_train_track_a_01342,"I stopped laughing, clearing my throat and looking down again.",0,0,0,0,0
eng_train_track_a_01355,I said sure thing.,0,0,1,0,0
eng_train_track_a_01363,Let's go back to the gym.,0,0,1,0,0
eng_train_track_a_01369,"My eyes followed, noting that there was just the two of us.",0,0,0,0,0
eng_train_track_a_01371,"And this charming, gorgeous, blonde struck up a conversation with me.",0,0,1,0,1
eng_train_track_a_01375,I turned to take a good look at the pictures and my jaw almost bounced off the kitchen floor.,0,1,1,0,1
eng_train_track_a_01383,I sit there with my shotgun and wait.,0,1,0,0,0
eng_train_track_a_01390,This morning after a cup of coffee I went upstairs to get dressed to go running with Scout when something caught my eye on the armrest of my rocking chair.,0,0,0,0,1
eng_train_track_a_01406,JUST STOP IT ALREADY!,1,1,0,0,0
eng_train_track_a_01412,"`` I thought that I was biting into something hard in my taco, but it was my TOOTH!",0,1,0,0,1
eng_train_track_a_01417,... as it engulfs every fiber of muscle in my legs!!!,0,1,0,0,0
eng_train_track_a_01418,so i just kept nodding my head and smiling.,0,0,1,0,0
eng_train_track_a_01419,"It made me feel weird, like my stomach was tightening and I could feel that stupid blush again on the back of my neck and yet I couldn't look away.I don't know how long I stood there, staring into his eyes like that.",0,1,0,0,1
eng_train_track_a_01421,"After we had finished eating, some of us continued shopping ( or wandering around the shops ) and a number of times, I was told to crouch down with my knees spread or bend over and had the jumper lifted.",0,1,0,0,0
eng_train_track_a_01429,Voice will occassionally change like in the movies.,0,0,0,0,1
eng_train_track_a_01435,": Already got one on my leg want another one on my left leg Yeah, my left leg, my foot, the back of my neck, my hand... want more?",0,0,1,0,0
eng_train_track_a_01436,Grandmother touches my hand.,0,0,1,0,0
eng_train_track_a_01446,They were dancing to Bolero.,0,0,1,0,0
eng_train_track_a_01461,"See, I saw the movie trailer first, and it looked interesting, ( and, yes, I do have a bit of a crush on Pattinson ) and in my head I made up my own story.",0,0,1,0,0
eng_train_track_a_01475,"But early in the morning, say five or six, they all fell asleep.",0,0,0,0,0
eng_train_track_a_01509,"The owners have a light in their yard for security purposes, but the light doesn't extend really far.",0,0,0,0,1
eng_train_track_a_01512,He was shaking the bed.,0,1,0,0,0
eng_train_track_a_01518,"I had my hand on the side of my face when I was drawing, and then I moved it and was like ` OH MY GOD I 'M BLEEDING OUT MY EARS AHHHHH!",0,1,0,0,1
eng_train_track_a_01533,We walked every aisle and I had so many ideas pop into my head.,0,0,1,0,0
eng_train_track_a_01550,Walking through the toilet aisle I decide to let a fart out and make the aisle smell.,0,0,1,0,1
eng_train_track_a_01554,it's two am and we pull up to what looks like a small house party.,0,1,1,0,1
eng_train_track_a_01564,"I wore cologne, to get the feeling right.",0,0,1,0,0
eng_train_track_a_01577,"He picked her up and put her in front of a mirror and said : ""Look, look at you!",0,0,1,0,1
eng_train_track_a_01582,"I stopped moving, bent down with my palm out, and let the squirrel jump up on my arm and onto my shoulder.",0,0,1,0,0
eng_train_track_a_01604,Or at least that's what the neurons in my brain say.,0,1,0,0,0
eng_train_track_a_01607,"Early the next morning, newspaper under my arm, I approached the counter of the coffee shop and asked for two medium coffees, black, three-quarters full only.",0,0,0,0,0
eng_train_track_a_01610,All this water gets poured directly in my face but I noticed it didn't hit my eyes and thats when I realized I Was wearing sunglasses inside!,0,0,1,0,1
eng_train_track_a_01611,I loved watching the planes fly over us and then this one plane was somehow flying in reverse direction.,0,0,1,0,1
eng_train_track_a_01624,for the wedding AND rehearsal dinner.,0,0,0,0,0
eng_train_track_a_01631,"I see the match, held tightly in my hand.",0,0,0,0,0
eng_train_track_a_01632,Second Event was with a crazy!,1,1,0,0,1
eng_train_track_a_01638,They're sitting right across the pool from my mom just STARING at her.,1,1,0,0,1
eng_train_track_a_01644,"Well, my birthday is in January.",0,0,0,0,0
eng_train_track_a_01654,some insulting some nice.,1,0,1,0,0
eng_train_track_a_01663,Wrapping his arms tightly around me and letting a warm breath escape his mouth onto the back of my neck.,0,0,1,0,0
eng_train_track_a_01667,We were going to reach seventy.,0,0,0,0,1
eng_train_track_a_01689,Dated a woman who invited me to her birthday party.,0,0,1,0,0
eng_train_track_a_01692,( Is it inappropriate that I can't get Steve Wonder's `` Writings on the Walls '' out of my head now...? ),0,1,1,0,0
eng_train_track_a_01697,Anyway it was weird.,0,1,0,0,1
eng_train_track_a_01700,My mum says that when she looked in the mirror she saw a pair of glowing yellow eyes.,0,1,0,0,1
eng_train_track_a_01723,"But in searching for some other sound to train my ears on, I realized there was no sound coming from Grandma.",0,1,0,0,1
eng_train_track_a_01725,My jaw dropped as I squealed with delight.,0,0,1,0,1
eng_train_track_a_01739,Driving around neighborhoods in the middle of the night on very little sleep everything gets to be a bit surreal.,0,1,0,0,1
eng_train_track_a_01742,"When I finally opened my eyes, it was into the searing white heat of a desert landscape.",0,1,0,0,1
eng_train_track_a_01743,"I became fixated and fascinated with abduction stories, with The X-Files, etc., for years.",0,1,1,0,0
eng_train_track_a_01761,Over the years I have taken pictures of what caught my eye.,0,0,1,0,0
eng_train_track_a_01788,"I crossed my arms, smiled, tilted my head, and said, `` I thought you were supposed to be in Austria? ''",0,0,1,0,0
eng_train_track_a_01793,Only then did I dare raise the camera to my eye.,0,1,1,0,0
eng_train_track_a_01794,The thing I neglect to mention though.,0,1,0,0,1
eng_train_track_a_01796,"He got the location, car make/model/year/color correct, manner of impact, impacting vehicle, everything correct.",0,0,1,0,1
eng_train_track_a_01815,"I chuckled, holding my hands up, and sat down in my comfy swivel chair.",0,0,1,0,0
eng_train_track_a_01833,"And without even stopping to think about it, I tuck one of those boxes under my arm and go back to the living room.",0,0,1,0,0
eng_train_track_a_01837,"I sat down and enjoyed one of my best poops ever, it was huge, it was liquid and it smelled fantastic (from my POV).",0,0,1,0,0
eng_train_track_a_01839,"On my legs and feet I wore leggings, jeans, and then the bib.",0,0,0,0,0
eng_train_track_a_01846,A knock on the door and my heart litarely stopped for a good three seconds.,0,1,0,0,1
eng_train_track_a_01851,"I needed to come out of a parking lot on the side of the highway and then pull the car up to a high speed so as not to have an accident/annoy highway drivers, so I was pretty nervously sitting there, waiting for the right opportunity.",0,1,0,0,0
eng_train_track_a_01854,That's super weird.,0,1,0,0,1
eng_train_track_a_01865,"I would always be downloading more music and burn it on new, cheap cds.",0,0,1,0,0
eng_train_track_a_01868,"My long brown hair caressed my face, small curls wrapping around my ear softly.",0,0,1,0,0
eng_train_track_a_01872,He took the picture and followed the giggling.,0,1,1,0,1
eng_train_track_a_01885,When something caught my eye.,0,0,0,0,1
eng_train_track_a_01893,Watch the mask re-cover my face.,0,0,0,0,0
eng_train_track_a_01909,"I stretched out my arms for balance, and bounced more vigorously.",0,0,1,0,0
eng_train_track_a_01910,We sat quietly to see if we could hear the voice again.,0,1,0,0,1
eng_train_track_a_01915,"( I was smart & bit my tongue ) Oh, and great results, but I'm not going into details... ow.We spent all day together, and got pizza & a ton of beer for dinner!",0,0,1,0,0
eng_train_track_a_01923,"Callie takes attention at my tone, having probably gotten used to my mumbled thanks in response to all of the attendees who had already been by, and she places her hand protectively at the base of my spine.",0,0,1,0,0
eng_train_track_a_01942,I totally freaked out.,0,1,0,0,1
eng_train_track_a_01945,That one was probably the weirdest.,0,0,0,0,1
eng_train_track_a_01950,"I'm not European-American, I'm a white American.",0,0,0,0,0
eng_train_track_a_01970,Then proceeded to duck and run past him into the female restroom.,0,1,0,0,1
eng_train_track_a_02002,"Either way, awesome night.",0,0,1,0,0
